example_id,preceding_comment,comment_for_evaluation,following_comment,toxicity,severe_toxicity,identity_attack,insult,profanity,threat
304716,And fidelity has after hours trades 😎,"Just have 1x that I like a lot, but generally steer clear.",MSOS moving a bit on cannabis banking today?,0,0,0,0,0,0
306740,"Get in the RIOT 🚀 rocket, she's getting ready to launch","It’s my biggest holding and I still don’t know what they do. 

Emperors of the revolution by 2060 maybe",BFLY,0,0,0,0,0,0
315092,Can't even remember the feeling of making money,"Made 2.5k yesterday, down over 3k today. Still up for the week but god damn. Everytime I make big gains I need to go cash gang for at least a day from now on.",JPow lost his toolbox,0,0,0,0,0,0
319821,CEO has cool hair. Cathie big love. Cool logo. 10x in 8 years.,830 chud,"Been here for a few hours now.

The MINUTE it turned 12gmt... you all start spamming AMC shit 

Boring",0,0,0,0,0,0
321288,"UWMC UWMC UWMC

Wolololololo!!!!!!!","Dude let the shares go. See where they settle Monday. Rebuy and sell more covers on them. Great play, nice profits.",RISE FROM THE GRAVE PLTR 🙏🏻,0,0,0,0,0,0
325152,GREEN GREEEN GREEN HAHAHAHAHAHAHAHAHAHAHA,"sorry bears, i bought puts...","Right?! Tempering my expectations, as usual",0,0,0,0,0,0
326832,Yes,"It was all a dream, I used to read bear trap magazine","I love Elon Musk, but TSLA is way over valued in my opinion",0,0,0,0,0,0
330906,How bout Diane Feinstein,Anyone know why GWAC just took off?,yep.. getting hedge manipulated.,0,0,0,0,0,0
331613,"Downvoter, what did you lose money on today?",Calls. Immediately,Why is NOK so undervalued?,0,0,0,0,0,0
331891,"Or...buy memes on dips, then sell again on inevitable highs, then dip, then high...and so on. Been workin' great.","I don't understand, it's just people liking the stock. And they're apes","When bers coming out to downvote comments, it's a sign from Tendieman. Gg bers. But, it's a Bulltime.",0,0,0,0,0,0
33348,"I SOLD EVERYTHING IN MY IRA AND PUT IN GME AND AMC.... BUY MORE YOU FUCKING RETARDS BUY MORE AND HOLD

AMC IS CHEAP 
GME IS CHEAP",Wrong thread,PLTR permanently stuck at $25,0,0,0,0,0,0
341525,Literally half price from what I bought two months ago,It’s the big boys trying to out game each other and us playing ridiculous 8 dimensional chess,* stock down .7%* CrAsHiNg!!!,0,0,0,0,0,0
341596,Yup everyday same shit,It defies market expectations today,counted my losses and went cash gang lmao,0,0,0,0,0,0
341985,"The year is 2030, the italian lira has made a return and it is now the world's most dominant currency","This is the absolute example of not catching a falling knife. Patience. Wait a week and see how you feel. Or don't, but the is a reason the stock is plummeting.","Other than aggregate PE ratios being higher than the historical average, what are the many other indicators that you're seeing?",0,0,0,0,0,0
343031,OCGN is crazy low.  One little announcement and it’s going to moon.  Everyone needs their  eyes! Huge money to be made as the 5G rollout is about to begin and people’s vision goes to shit.,Yeah uco did the same thing last year and fucked me.,What do u think about a 123 call expiring this friday,0,0,0,0,1,0
344591,Bout to move to India cuz we bulls are worshipped as gods there,Thetagang absolutely FEASTING,"You meant GPRO 3/26 $15 calls, right?",0,0,0,0,0,0
345604,"He is not financial advisor, for entertainment purposes only.","Confused AF by their app;I just got approved last Monday for options trading on Fidelity, couldn’t be more confused by their options layout, u2?",Time to buy more off that bank dip. Think it’s finally moving up a bit,0,0,0,0,1,0
349830,This market is fake af,Welp I guess I’m diamond handing these TSLA calls overnight,And then it’s gonna moon the day you sell,0,0,0,0,0,0
351156,"""Boring day""

*SPY up 3%*",Gotta take profits homie. Quit being greedy,It’s trash,0,0,0,0,0,0
353283,The internets,"Non-AMP Link: [https://www.marketwatch.com/story/gamestop-says-chief-customer-officer-frank-hamlin-to-step-down-after-transition-period-ending-march-31-2021-03-23](https://www.marketwatch.com/story/gamestop-says-chief-customer-officer-frank-hamlin-to-step-down-after-transition-period-ending-march-31-2021-03-23)

I'm a bot. [Why?](https://np.reddit.com/user/NoGoogleAMPBot/comments/lbz2sg/) | [Code](https://github.com/laurinneff/no-google-amp-bot) | [Report issues](https://github.com/laurinneff/no-google-amp-bot/issues)",Or a sad sad angry day,0,0,0,0,0,0
354855,Boomers attached to this dogshit stock for some reason.,2% is inevitable man. Why buy bonds now when you can wait weeks/months and get a better rate. Basic market psychology suggests there’s plenty of room there.,He said GME! Upvote this ape!,0,0,0,0,0,0
355938,Got some cash freed up just in case.,Please yes. I have had a $100k order at $60/share sitting for weeks waiting to be triggered.,"Guys, seriously now. What the fuck happens if markets crash again? Interest rates already at 0% and we have already pulled out unlimited QE. What now?",0,0,0,0,0,0
357625,-_-,People are still buying AMC after the CEO announced that they're diluting the stock by 100%. You all might actually be retarded.,Apha just keeps going lower,1,0,1,1,1,0
358710,So you gave PLTR a good entry?,Imagine being a virgin bull and buying at these levels while your wife's bear boyfriend bangs her out every day 🌈🐻,Told y’all about GPRO puts yesterday. Hopefully some of you got on board.,1,0,0,1,0,0
359698,So when is the 6 year bull run officially over?,"Keep buying shares because other people who don't know anything are making posts about the fact that it will definitely skyrocket someday and this is their ticket to the easy life. 

There's no gameplan. They think they freeze the price at $1k a share until all the verified normal people sell off and only the hedge funds will buy or something. They still don't have an exit strategy.","Tell me your short positions frens.

Im short on Uber, GM, and Ford atm. Want to short RBLX aswell but etoro wont let me...Also looking at volkswagen very closely.",0,0,0,0,0,0
360530,M$ft on rapid fire today. Damn,PLTR please fly again,Jpow is speaking in 40 minutes. Probably going to dip back down after he’s done.,0,0,0,0,0,0
370828,"P: Pretty  
L: Limp &  
T: Tiny  
R: Rockets.",This,Whelp all my covered calls printed 😖,0,0,0,0,0,0
370919,The memes tomorrow will be great either way,Apes have ruined WSB,"There won’t be a single virgin left on wsb.   
We’re all getting fcked today.",0,0,0,0,0,0
375439,You should place a short and make all that money.,Brain stop,The naysayers missed GME when it was cheap and are scared to hop on now. They could be right. We could be right. Which one of you has a glass ball? I’d LOVE to know who can see the future,0,0,0,0,0,0
379087,"If my account falls below 25k and I get flagged under PDT, are they gonna sell all the options I hold?","Sorry, was replying to me. Haha. They just priced notes at $85.",Please be a bear trap please be a bear trap,0,0,0,0,0,0
386699,RED IS MY FAVORITE COLOR,PLTR 😂,"Yeah, probably don't stoop, but definitely use every legal option to get him to stop. Definitely report him.",0,0,0,0,0,0
39156,(PLTR) Stock a Buy ?!,PAY ATTENTION - Hedge fund trolls in chat trying to push stock down,Go go AMC,0,0,0,0,0,0
395868,"like wtf do i even average down on? i've been averaging down for weeks. scared to even make theta plays selling puts on anything in this market, might just delete the apps and reinstall in a few weeks",Today is the worst. Thank god I sold everything in the morning,What was the dilldozer in eurotrip? ya that's what today felt like,0,0,0,0,0,0
399810,Plus500,Been buying the dip but bitch keeps dipping,"God damn, I almost bought some $36 PLUG puts at open yesterday and thought “nah, it’s dropped enough already”. Then I reconsidered buying some $33 puts around close and thought the same thing. God damn I wish I had done that now.",0,0,0,0,1,0
402289,#OK THAT'S ENOUGH! Is it Friday yet😑,It’s a dilemma.,Wait until they discover the short elevator attacks,0,0,0,0,0,0
403007,THANKS FOR REMINDING ME TO BUY SNOW TODAY JIM,Buy puts,Here comes another day of getting my poop pushed in,0,0,0,0,0,0
403136,Lol delusional,Fuck I think I just landed in tomato town,Let's close markets today please. Long weekend,0,0,0,0,1,0
40319,WTF,I bought the dip,"UVXY puts here, I’ve played that ticker so many times only for it to fuck me over the next day. 

Shit will bounce tmr",0,0,0,0,0,0
404420,Is this the bull trap or is the train finally getting back on the tracks?,reverse  guh,"Hope you guys enjoyed 🍏, now back to 🍎in 3, 2, 1...",0,0,0,0,0,0
405298,"I am making tacos today.

-Not financial advice","“The market isn’t down, look at the nasdaq and the Dow.” 

Why the fuck are you even here.",Are the apes dead yet?,1,0,0,1,1,0
411850,"Every time I read comments on here it seems like the market is down 10% or something crazy, then I check and we’re up .05%.  Everyone gotta chill.",And here I am paper handing spy straddles and barely making anything,Don't bring that shit here,0,0,0,0,0,0
415568,Politics can affect our monies though,MIDAFTERNOON DUMP,"bruh, what do u think😂u didn’t see him read the reporters name off the paper? Everything is in order and all his answers are there prep’d by his staff.
Holy fuck he’s legit lost as i type this trynna read his paper😂😂",0,0,0,0,0,0
41842,Someone buy a shitload of puts and turn this around for us.  Take one for the team.,8k to 4K,"They don't understand what those, or any, words mean.",0,0,0,0,0,0
420844,LOL. Now your on the side of the squeeze?!?!! Hahahahaa you literally just fomod into GME. Get fucking rekt nerd. I can’t believe it is so easy to fucking rekkk people like you.,Tesla puts. All of my history says it.,"Well either massive cargo ships take 2 weeks to circle around africa or theyre just gonna sit and wait until the one ship blocking everything up gets the fuck out. The 2 weeks are probably already priced in and the whole incident is estimated to cost around 9 billion. If it takes longer than 2 weeks to get that ship the fuck outta the way tho, that cost is gonna keep rising",0,0,0,0,0,0
421482,"Leave WSB. Put all your money into Vanguard ETFs.   


Wait 20 years.",Look how salty 🧂people who eithier gave up on GME or had puts are right now 🤣 I think I just got a boner,NIO MOON TOO SOON JUNE 22 WAS $7.22,0,0,0,0,0,0
424297,Ur mom has 1 share,See above,He the GOAT ( 🌈 est🐻 of all time),0,0,0,0,0,0
425380,"front page of CNBC:


SoFi to give amateur investors early access to IPOs in break from Wall Street tradition 


SoFi will be better than RH, oh and they'll have options this year as well. 🚀 🚀 🚀","Yeah you know it's a noob when they have no idea what MOC orders are and say ""WOA, SOMEONE BOUGHT 3M SHARES OF THIS STOCK AFTER HOURS! SOMEONE MUST KNOW SOMETHING!!""",All in on NIO at open?,0,0,0,0,0,0
42556,"Buy high, sell low. Amirite?",9 minutes to finish green we can do this,Congress putting a stop order on the USPS OSK deal in favor of WKHS,0,0,0,0,0,0
4260,🚀🚀🚀🚀🚀🚀,"Which option, whats the problem?",It says wire transfers funds are available immediate for trading on securities like options. If you do a ACH transfer it takes like 3 days,0,0,0,0,0,0
426017,In 1869 they told me the Suez couldn't go tits up. WTF?,G_M_E,Nio sale? 👀,0,0,0,0,0,0
426329,"never seen spy move this slow at open, bizarre",PTON please to the moon 🌝🚀⬆️🚴🏽,Did NIO executives get sent to a gulag by the CCP or something?,0,0,0,0,0,0
431090,Yeah not because all of tech is,Pltr and wmt are inverse ETFs I swear,Yuck who drools over a stonk,0,0,0,0,0,0
4324,Just going to have to use it till gme is over and then transfer to something else,buy the dips,Did these hedge funds really never close their positions or did they decided to put their balls on the chopping block again? Is this still the same battle?,0,0,0,0,0,0
432547,Another thrilling roller coaster ride of a day for AAPL...When it traversed from +.026% to -.014% I was on pins and needles. What will the rest of the day bring? Will we end at $120.46 or $120.32?,"So glad to see ya'll bearish again..

Calls printing next week bois","Literally just bought, but shares I’m expecting it to go down more though",0,0,0,0,0,0
434613,🤫 don’t tell my husband,Right just get it over with already,Do it. I just shorted it so you should be safe,0,0,0,0,0,0
436805,"Dang, it's hard to see TSLA struggling to stay above 600","According to their profit margin, that might be the absolute value...

|-$3000|","I don't think we have enough lithium to make enough of your electric cars.. Limited range, long charge times, doesn't do well in cold..  


Gas powered cars ARE the future, bro.. We've got what, 70 years of oil left at current consumption rates?",0,0,0,0,0,0
44021,I need a shower after that fucking,What did she do,THOUGHTS ON MOTHAFUCKIN URANIUM?,0,0,0,0,0,0
441711,Yay! Can I post yet?,"headline: THE BOAT IS FREE

story: to hang around for a couple more days",Why does everyone think spy’s hitting 400? Did I miss any news?,0,0,0,0,0,0
445417,isnt it crazy how we all die one day,"I came expecting swings and whipsaws.


Wtf is this","Yup, that aint happening",0,0,0,0,1,0
446443,Guys... RKT isn't done yet. Check out the 4H chart,"I'm going to save everyone a lifetime of money.   


Only BUY option at 3:30PM  


Only SELL options at 10AM",Markets just sleeping no volume just stand still.,0,0,0,0,0,0
448404,Thats it?🥴,"Me too me too, not selling","It won’t. Tech always comes back booming. Forward speculation drives the market. No other sector has the growth potential of tech. New markets, new companies, and new business models are where fortunes are made. That’s where people put their money.",0,0,0,0,0,0
452183,Keep? You have money left?,PLTR will do great things. She's just in one of her phases right now...,20 4/16 35c. Got them cheap. It lays dormant then suddenly awakes with a vengeance so we'll see.,0,0,0,0,0,0
457238,Does PLTR know how popular PLTR is? I think PLTR has confidence issues,"Ehrm, you meant us Europoors or did I miss something?",In your opinion how do you feel these announcements will affect the stock price? I feel like HF will still be attacking until they liquidate themselves(if that's even possible),0,0,0,0,0,0
458932,"Unload? What are you on about you fool, hold","You left your post, if you stood guard like you were suppose to these fucking bears wouldn’t have got in. Fuck u","Hey bud, go away!",0,0,0,1,1,0
460395,And what happened when papa cohen joined?,"if you could give everyone else 30bn or yourself 3bn, what would you choose?",Yup,0,0,0,0,0,0
460587,Holy shit what happened to GOEV? Red on every chart.,About if you've considered $ROPEing today. No shame; I can't be the only one.,Cry,0,0,0,0,0,0
460706,I’m waiting 🤔,Sugar gay,BB is such a piece of shit it's pathetic,1,0,1,0,0,0
461849,Is Epstein on the board?,Can we get a -10% day on Tesla again. I wanna see cathie woods mommy milkers on onlyfans,"No, just have some puts expiring at 4/1",1,0,0,0,0,0
463701,Still on the VWAGY ride - enjoying green,Tesla back or is this a dead 🐈,In so much pain.,0,0,0,0,0,0
464038,NY LEGALIZED RECREATIONAL CANNABIS.,The only sad thing about my calls finally going in the right direction is the giant pit they are starting from.,yeah they beat down pretty bad.,0,0,0,0,0,0
46848,"today at opening i sell my RKT shades to hold my only 3 shade of GME and buy strong EMAN, hope this is going to be a good idea","My bad you’re actually autistic, go and trade Pokémon cards maybe you’ll have better luck",Webull gives you way more information and lets you trade premarket and after hours.,1,1,1,1,0,0
469095,Best wagon name is pussywagon from Kill Bill,Saw a couple of homeless guys vaccinating themselves out by the dumpster. We're gonna have covid knocked out in no time,Then you haven't had your soul crushed yet.  You're doing pretty well.,0,0,0,0,0,0
471132,"This AAPL shareholder changes his rating from ""Hold"" to ""Fuck you Tim drop me off here at the corner""",Yeah better to make money then lose it,"what do u mean? if the liquidation is truly over, you would expect these stocks to recover considering there was no fundamental change. That’s at least the most basic way to look at it",0,0,0,0,0,0
47154,Petition to make gme thread meme battle arena,Yessir,Buy more gme,0,0,0,0,0,0
474301,"Honestly I think GOEV after that ""earnings"" beat down. Im not sticking around long, but I think it will hit enough algorithms and screeners for some swing trde action on cheap calls",The simps for sure.... to this day I don’t know where they get the money to spend on those chicks from.....,i did,0,0,0,0,0,0
488146,the apes won’t let it die,Cant wait for +3% PM tomorrow and then -1% all day! It's gonna be fucking 🔥🔥🔥🔥🔥,All u pussies who believed Hindenburg can suck a big one.  $RIDE OR DIE BABYYYY,0,0,0,0,1,0
489934,Wen lambo,"nah dude your probably gonna end up getting her pregnant and ruining your fucking life, dont do it. There are tons of hotter women out there, although they are probably all crazy and toxic as well.",Sounds mad. Miss the boat? Sucks for you.,0,0,0,0,1,0
492494,Breaking - Steel closing all retail locations,LOL someone put a market order on some 315 QQQ puts and got them for .45 at open. I’m sure they’re fucking piiiisssseed,"#”WE PRINT IT, DIGITALLY” -JPOW

#”INFINITE TOOLS”",0,0,0,0,1,0
496691,"Agreed man, but Diamond hands isn't saying no to like 300% profit lol.",RKT and PLTR keeps trying to match each other in prices.,Boy am I glad I loaded up on spacs. Pain.,0,0,0,0,0,0
498998,Nice buddy,broken record,Tesla red smh,0,0,0,0,0,0
501339,you don’t remember november?,Dew it,"OR - you get some people who see that low liquidity can create a spike and a bunch of WSB Autists decide to start buying it and then people FOMO in. You’re not gonna get 35k shares trading hands off of 1,180 shares short or 9% of daily volume.",0,0,0,0,0,0
503970,"DO IT JPOW

INSERT THY DILDO THROUGH THE BEAR ANUS",also on hbo max if you have a nice TV,Lol right.....its free money.....my cost average on the 108 shares i have left is $10.69 🤣🤣🤣,0,0,0,0,0,0
504709,Only thing your getting tomorrow is eggs,Imagine getting to play Doubting Thomas with Cathie 🤤🍆,Buy the rumor sell the news my friend,0,0,0,0,1,0
507846,"> plus I’m goi

I believe that this is..... the way?",Can't sell half when you only have one,"I think ppl dont know what schadenfreude is..
Thats why you haven't been downvoted yet lol",0,0,0,0,0,0
50901,"More RKT DD for the people who missed the first few. We're still on for this whole week! 50-60 by EOD

https://www.reddit.com/r/wallstreetbets/comments/lwgzjs/why_its_not_over_for_rkt_more_shorts_have/?utm_source=share&utm_medium=ios_app&utm_name=iossmf",RBLX IPO coming march 10th 45$ a share,"The OG UWMC messiah ^
What’s your play at open these premiums boutta jump",0,0,0,0,0,0
51054,🤦🏼‍♂️,im in on launch,"No idiots here mate, I learned that in the last 2 days only!",0,0,0,0,0,0
511453,I'm a pussy and only do it with SPY. I dont want to bag hold indefinitely for a company,Too many positions. I'm an idiot.,i would wager the long weekend was worth the wait,0,0,0,0,0,0
511581,300 pre split so 75$,"Yeah, any line of sight toward what just happened here?",when Tesla earnings?,0,0,0,0,0,0
512724,Anyone is noticing Motorola? ATH.,Nio really bringing my porty down,Let's hope so.,0,0,0,0,0,0
514712,Still ain’t no one gonna fuck you tho,"I keep buying the SNDL dips, and it keeps dipping, what am I doing wrong?

&#x200B;

Edit: I'll keep buying the dips then, it can't dip lower than 0 right?",Not a fan of this gray market,0,0,0,0,0,0
516428,Buy high sell low. That's the motto,Lmaoo,"The AMC shorts are doing such a phenomenal job of slow bleeding the apes, that playing 1-month-out puts literally every other day has been free money for a month. It's gonna be over soon, as the stock inevitably plummets, but by that day I will have gathered more than my fair bear share of ape meat :)",0,0,0,0,1,0
518393,Bye bye money....wish I wasn't so greedy 😭💸,Yellen is a real GILF,$411,0,0,0,0,1,0
521694,I walk a lonely road... the only one that I have ever known,"Lambo, come! Come!",I sold a $60 strike 5/21 CC lol,0,0,0,0,0,0
524663,Made a battery deal with Paccar EV,Is a fintel subscription worth it?,Arkk,0,0,0,0,0,0
526799,Baba sell grocery.  Baba go brrrr. Imagine the checkout line with 1.5b ppl....,So many people on here have no idea what the fuck they’re doing,all my gains today are no more fuck CRSR,0,0,0,1,1,0
52789,UWMC thread.  UWMC has been included in the preliminary list of IPO additions for the Russell 1000 and Russell 3000 indexes,Pretty happy I bought this last year hopefully it gets EV multiples this year and moons,"All the leaves are brown
And the sky is gray",0,0,0,0,0,0
528383,"At least you made some profit, I just took a 30% loss 🤡","Fuuuuuck my job is overwhelming rn puts on my sanity because my punch list this Friday is fuuuuuuuukt, on the bright side my VIAC calls are up",S&P dropping kinda fast right now.  SPY dump unavoidable?,0,0,0,0,1,0
528601,How convenient of an Aphria hit piece to come out a week before earnings,I used to just wish for money. Now I wish for money and for trash stocks to die.,"Sold this morning, pre meme stock strategy, but may miss the “squeeze”.",0,0,0,0,0,0
529034,Why dont you just shut the fuck up and make my wendys burger lol,Like you can’t sell them before they expire?,tomorrow,0,0,0,0,0,0
538404,If I had to guess maybe SPY puts for Friday? Meeting today plus daddy Powell talk tomorrow..more than likely won’t go tits up,Where are my GOEV jabronis at?,"Been hopping around all the typical retail mobile brokerages just cause Ive told myself to take aim at profits even when Im out of daytrades. Or Ive just accidently fucked it up lol. Webull, which I'm now trying after accidently selling and then buying the same call on Tastyworks with no DTs left,  is suprisingly not at all shitty. Better charts than even TOS on mobile at least, and they actually let you profit from lending stocks and what not.",0,0,0,0,0,0
539912,Now thats the DD I come to WSB for!,"I'm no bear here, but SPY just can be green everyday for 8 days and etc.","Weird how nearly all hedge funds use a long/short, delta neutral portfolio strategy and I am out here yeeting weekly calls and begging for the red candle to stop. It stirs something in my reptilian cortex that maybe I have the wrong approach... but no. It must be the hedgies that are wrong.",0,0,0,0,0,0
542301,you haven't seen me play,🌈,My avg is $32 bc when I buy everything drops a dollar and just chills,0,0,0,0,0,0
543776,That’s how I make my money.  Not gay if it’s for pay !!,Anyone think ENPH is going to go back up? I'm confused at its activity. You'd think with a new administration that's focused on green there wouldn't be this much red but it's only gone down in the last 4 months. I'm thinking of playing some long calls tho,"My UWMC calls have wrecked my gains. I wish you luck. Mine expire on the 16th, so yours should print on the 17th.",0,0,0,0,0,0
546266,We are no longer in easy mode.,Exactly 1/3 faultless,SPY 🐻 holding L’s whats new,0,0,0,0,0,0
55027,UWMC megathread PLEAASE!! I need it haha,"ok just follow the ""real"" accounts spamming Rocket when you know its gonna tank ever more",I Like MINE!,0,0,0,0,0,0
552766,Manifesting BABA to run to 235 🚀🚀🚀,I don't have a mom so jokes on you bud.,"Lol yeah, because that’s what this sub does all day long is net better returns than MSFT all day long. Hilarious. I’ll take 8% since the HaloLens announcement on MSFT all day long. Shouldn’t you be selling off your portfolio now?",0,0,0,0,0,0
555640,Banks dont eat losses like that. We the tax payers bail them out,"Like a true bear i am looking at my 0.07% gains and thinking ""fuck yeah it isn't red""","I'm afraid that's one of the positions I closed. I made a decent margin on it but I worry PLTR is going to drop in the short term. They're facing scrutiny for the awarding of government contracts in the UK and I think there's a strong possibility the same could happen to US contracts. Long term it's a good stock to invest in, but I think I could drop further in the short term.",0,0,0,0,1,0
556558,"Worried about what, though?  That RKT is going to suddenly go bankrupt?  That the stock will crash from $22 to $5?  They've made some insane money over the last few years, but prior to that, they still made insane money.  I just can't see RKT as a company going under suddenly. 

Compared to what some of us are throwing out as bets, RKT feels boring.",Buyer or writer?,SPY 409 4/9 let’s gooo,0,0,0,0,0,0
557270,This is the way.,"Nah, just block her and forget about it. I played that game last year and it all gets better when you block the number and socials.",anyone going in on this riot dip?,0,0,0,0,0,0
559454,spy only go up,For sure. If guidance is trending weaker from mega cap companies then the picture changes a bit. Its also possible that this year has all of gains concentrated in a couple of months and goes sideways/slides the rest.,"Imagine going from 2k to 200k to less than 1k in 90 days. 

Ho Lee Fuk",0,0,0,0,0,0
559820,Fuck i wanted to buy puts on cmmb.,What does valuation have to do with a stock?,Because it’s going WAY higher cmon man,0,0,0,0,0,0
560992,What Josh Rogan ?,"We gonna need netflix in space bro, I don't think there's any weed out there","That’s pretty much exactly how I feel about the situation, and I think (or at least hope) she’d say the same. Thanks for the words of encouragement friend",0,0,0,0,0,0
