example_id,preceding_comment,comment_for_evaluation,following_comment,toxicity,severe_toxicity,identity_attack,insult,profanity,threat
108629,$SKT puts are PRINTING,When it hits $5k will you sell?,"Your username says it all, SAD",0,0,0,0,0,0
108801,Apples always a buy not advice,Diamond hands bro - relax,buy the dips,0,0,0,0,0,0
109891,$T still holding the line for me,OMG Yasssssss,2 weeks? The way its crashing I wont have a portfolio in 2 weeks. This thing better get started next week.,0,0,0,0,0,0
111247,It’s only been a couple weeks. Could easily crash another 5-10%.,About as good as time as any.,GME spike up?,,0,0,0,0,0
121362,Holy shit at that candle. Seems like a long and short HF put roughly the same volume at the same hour haha. 156.02/149.95,You can short or buy options yeah,Casual 110k volume spike,,0,0,0,0,0
121865,Thank you for the update and all your work.,"Holy shit, strong catalyst",He's live in 13,0,0,0,0,1,0
1228,I am unfortunately one of those frogs.,Alright so what price will I get on board with this morning? Under or over 200?,About three fitty,0,0,0,0,0,0
122974,The only honest comment,Do it be a legend,You lumping rkt in with pltr makes me want to go sell all my pltr shares immediately,0,0,0,0,0,0
125170,"Man good thing I am not in tech!! (Not smart enough to buy strikes this far out, I’m already at 0)",And I have aapl calls🤣,Fuck bears all my homies hate bears,0,0,0,0,0,0
127400,"You have done an excellent job at wasting my time.


*I am a bot, and this action was performed automatically. Please [contact the moderators of this subreddit](/message/compose/?to=/r/wallstreetbets) if you have any questions or concerns.*",Bullish!,"Good call, I didn't buy that either. It looked like an inadvertent pump dump. I don't think anyone intended that, but nevertheless...",0,0,0,0,0,0
133902,No,"My stimmy has boarded the ship, make room.","Bought ARKF at 60
Bought ARKG at 112
Bought ARKK at 153
You're welcome",0,0,0,0,0,0
13729,"Even though this is exciting, ya'll have to realize this is not sustainable. I'm pretty sure a whale caused the spike in price. You guys make up like 1% of GME, so you won't affect the price as much. We're playing their game. Please put a trailing stop loss or something so you can get out with some profit :(","If there are no sellers, it shows as $0.01 until a price is listed.",Because you’re losing faith,0,0,0,0,0,0
138055,Sold too early last week so naturally I'm going to hold way too long this week,What’s the Robinhood number for refunds?,"That's a great question. It's an important question. Thanks for asking it. As I said in my opening statement, I appreciate you inviting me here to talk about this today. It's something that hasn't been discussed enough in my opinion. In conclusion, we're out of time.

*I am a bot, and this action was performed automatically. Please [contact the moderators of this subreddit](/message/compose/?to=/r/wallstreetbets) if you have any questions or concerns.*",0,0,0,0,0,0
139202,"She worth 100M 😆 
We the chumps she gucci",XLE analysis from any chart pros? What's the verdict for the coming week?,My account balance just showed all 7's for a hot second. Bull run confirmed.,0,0,0,0,0,0
142836,Dumped a bunch of $CUM for $GME,People keep telling me I won’t be able to time the market.. little do they know I’m timing it for a loss,Buying again after it's up 500% in a week? Way to loose massive again,0,0,0,0,0,0
144925,"There’s already a pretty good one near me, owner is a friend of the family. Think I’ll let him retire in style.",Put finger in it,"You can take some profits and let the rest ride. If that $700 makes a big difference to you, you have already won huge. FOMO is a powerful drug but can definitely make you irrational.",0,0,0,0,0,0
151297,VFF,"2.67 shares here tryna pay credit debt lmao, see you on the fucking moon!! 🚀",I will either get nuked from orbit or ascend to orbit with $SEARS,0,0,0,0,1,0
151962,Short the bounce instead... You'll make way more $$$,$AGE,$695C here!,0,0,0,0,0,0
154117,"A year and some change, I got a new fish and I think it bullied this guy to death. He wouldn’t come out from under this rock after I got the new one although it doesn’t seem to bother anything else in the tank",Definitely do that and baghold like me lol. But yea I’m extremely bullish on TSM I just hope it can start recovering now.,Probably show up after lunch,0,0,0,0,0,0
160068,Eat Shit,The explanation is the 30% drop last week,I'm taking profits at close. I may or may not regret that.,0,0,0,0,0,0
163093,Do that 10 times in a row and your all set!,"> https://www.barrons.com/articles/roblox-sets-date-to-go-public-through-a-direct-listing-51614036401

oh shit thanks, didn't know they were doing a direct listing...maybe I'll pick up some shares and not instant sell like I did with PLTR when it traded red for a couple weeks post listing",Pltr has significantly more volume than TSLA today. Odd,0,0,0,0,1,0
165989,Cliff dive,"The best MMORPG is the stock market.

NASDAQ, SPY, DOW, NYSE are some of the world servers. 

You can fight bears/bulls/kangaroos/apes when you enter the different battle zones. These battlezones include webull, robinhood, fidelity, etc.

Additionally , you can equip rare items such as paper, diamonds, rockets, etc on your characters.

To level up, you just need to win your fights in the battle zones and increase your wealth. You may die at times, and you may respawn at 0 to fight again and work your way to the top. 

The GM (game masters) include DFV, WSB Mod and NPCs are r/investing, r/stocks who try to give financial advice.",Good. You deserve it,0,0,0,0,0,0
167578,That said $45,Here comes Christian Bale from American Psycho with an axe!!,BILI,0,0,0,0,0,0
169661,Are we holding amc through earnings?,Worse yet a lot of tards post buying shares as a YOLO,"I sold half at break even, but I still have 15 shares, it’s up for me this morning. I do have it set to sell when I double, not sure if that’s the right move though.",0,0,0,0,0,0
175027,save me at $14,"theres also a chance we do this whole inflation fear dance again 

but for now the bond market seems to have stopped ringing the alarm","I'm thinking of selling my INTC calls now

Biden bux are going to set the market on a green fire",0,0,0,0,0,0
1757,If Tesla can stop making cars and their stock is completely unaffected I give up,"BUY AND HODL

BUY AND HODL

BUY AND HODL

BUY AND HODL

BUY AND HODL

BUY AND HODL

BUY AND HODL",someone who is panic buying at 90 and panic selling at 10 rsi shouldn't have access to markets,0,0,0,0,0,0
177395,Right back up. Weak dip IMO,Bull trap again?,bulls that are bear-curious or bears that are bull-curious?,0,0,0,0,0,0
179511,So happy I loaded up on more last week when it was at $33 - brought my AVG down to a good one.,U mean the dead cat bounce?,Username checks out,0,0,0,0,0,0
179576,is it over for my 95 shares of NOK :(,Wondering the same,We up 18%,0,0,0,0,0,0
182475,I am not a cat!,"So Guhstop is now biggest component of Russ 2k accounting for a whopping 1% of the index. A very large move by GUH could actually affect IWM noticeably(small, but still). Very tight IWM plays could be a decent proxy move with low IV and way less risk. Thoughts? Not gonna make you rich but a sensible way to play from the sidelines.",I was also at the gym funny enough. I sat on the bench and just stared at my phone. After the market opened I just left & watched Robinhood like a hawk.,0,0,0,0,0,0
186710,"Nah, we good fam",Ladder attacks on the entire market :(,There are probably people out there that bought the peak of GME both times. Got to hurt.,0,0,0,0,0,0
186975,r/bagholdersanonymous,"Me watching on the sidelines when GME goes up: Fuckkk these guys were smart I should have gotten in, maybe it’s not too late.

Me watching on the sidelines when GME goes down: Whewwww these guys are fucking retarded, good thing I didn’t get in",Idk why but I feel like it's hanging on by a thread,0,0,1,1,1,0
188460,What does the bond yield thing mean,"10 yr plummiting, covid bill comming, recession canceled, bers, your bonds have failed you once again",this market isnt a casino its a damn circus.,0,0,0,0,0,0
188760,"Rapid 10% shifts I believe

Volatility is the less precise, potentially more accurate answer",Who’s excited about AMC quarterly report?,TikTok pumpers,0,0,0,0,0,0
188964,Lol,Yuck. You have horrible taste brah,Where the fuck is RBLX,1,0,0,1,0,0
192043,PAHMP IT JOEY,Wow last second addition to the stimmy that cash app will be the exclusive distributor of the package... SQ valuation upgraded to $2500,"Say it with me, short squeeze",0,0,0,0,0,0
195360,Over half of the users are under 13..,At which point I’ll welcome you to the “tax write off for 5 years club”,I wish things would pump during the last 30 minutes of the day for once 😒,0,0,0,0,0,0
196930,Turns out you were right 🤷‍♂️ somehow still got downvoted 😂 people on here are allergic to money... gonna keep holding Roblox 🧱💰,Realistically How could AAPL July 125 calls possibly not print??? Thoughts on this vs just buying shares...,"My ADD ass went into GOEV instead, forgot about roblox, and didn’t even take my own advice, not mad about the GOEV doe🚀🚀🚀",0,0,0,0,0,0
204002,Apple please go up enough with the down and sideways trading bullshit,Current mood - X gon give it to ya,Team Rocket's blasting off agaaaaaaaaaain!,0,0,0,0,0,0
204244,A lot of people talk about gamma squeeze option but I’m too noob for it,# Looks like I'll only be able to buy 0.69420 shares tomorrow,PLTR 28 eod,0,0,0,0,0,0
204613,FCEL undervalued,TSLA about to make its daily trek to 666,Children are addicted to Robux. Market boomers just don’t realize it yet,0,0,0,0,0,0
207918,"Just need a few more days of this and my portfolio filled with PLTR, NIO, and ICLN will finally start to look better. Past month has been rough.","What r u in, I’ll buy",Next week zaddy,0,0,0,0,0,0
208228,What an amazing week. Take a second to appreciate it after how bad last week felt,Your name alone makes us friends.,"do what DFV did and find undervalued stocks

with the vaccine proven to be successful earlier this year, travel stocks and oil were no brainers, they were all still way off their pre-covid highs

none of them were being pumped here but they have all been flying since the beginning of the year

tldr; just use your brain on what kind of stocks will benefit hard when things are reopened and COVID is gone",0,0,0,0,0,0
211520,"It was always clear to sell GME at the height yesterday and roll it all into RBLX. If you didn't make that move, you fucked up.  


If you didn't buy Roblox when it opened, you fucked up.  


If you didn't buy Roblox before $70, you missed a great opportunity, but you can still fix that mistake.",you haven't bought enough,correct. you'd be an idiot to fight the printer at this point,0,0,0,0,0,0
213042,"Jesus, Buyden looks like he’s aged 10 years since election.",...i completely forgot that mexico probably has its own stock exchange flood into that shit boys while we wait for weed to be legalized in the south,Sndl going up,0,0,0,0,1,0
213524,THETA DECAY THETA DECAY THETA DECAY THETA DECAY THETA DECAY THETA DECAY THETA DECAY THETA DECAY THETA DECAY THETA DECAY THETA DECAY THETA DECAY THETA DECAY THETA DECAY THETA DECAY THETA DECAY THETA DECAY THETA DECAY THETA DECAY,Bad news is also bullish,Buy Pltr leaps ASAP 😳,0,0,0,0,0,0
214296,"Hey shorty, your portfolio is on fire",Same here. I always end up buying another call or two on the dips and end up regretting it...then on the overnight jump I’ll make most of my losses back and freak out and sell lol,"it went up 5.5k in 2 days, sketchy as fk",0,0,0,0,0,0
214297,Same here. I always end up buying another call or two on the dips and end up regretting it...then on the overnight jump I’ll make most of my losses back and freak out and sell lol,"it went up 5.5k in 2 days, sketchy as fk",literally me,0,0,0,0,1,0
218074,I see snek awards I post 🐍,Reminding myself to buy the dip!,Breaking news: Jim Cramer and vlad tenev are romantically involved,0,0,0,0,0,0
220143,"Market is going to have a bloody day while gme moons.  Institutions will need to liquidate other positions to cover. 

I'm running out of both red and green crayons to eat and will soon need to order more.

Trust me I've been here for 6 weeks, and that makes me  pretty much an expert.",Mods...,"Stimmy goes in, tendies come out 🍗",0,0,0,0,0,0
220293,Can I get a “ GREEN BY OPEN” !?!?!?!?,Options,Should’ve bought GME,0,0,0,0,0,0
22144,Alwaaays. God I love that mouse,Massive NOK volume this morning. About to rocket upwards.,Definitely long on NOK,0,0,0,0,0,0
222526,what is a toy company,"Join us brother. 

Texas also just reopened fully and stimulus checks are set to hit direct deposit soon.",During the last dip? You mean a week ago?,0,0,0,0,0,0
223359,Calls on the zipper industry,for ?,Sounds like a damn good idea. Apple absolutely crushed it last quarter and is down 15% from ATH?,0,0,0,0,0,0
225806,"new ford, who dis?",qqqj calls?,i mean if you're absolutely failing just throw your money into something like FZROX every week and don't touch it again until you need it,0,0,0,0,0,0
231134,Name a legitimate tech IPO that has lost money long term.,God im bleeding so bad. Im just tryna outtrun this fucking fed call today WTF howwwww 🤢🤮,"Bulls gonna run forever!!!!

$PLTR - Positive, $TLRY - Positive, $AMD - About to be Positive!

🐂🐂![img](emote|wsb_emojis|bull)🚀🚀🤣🚀🚀🤣",0,0,0,0,0,0
235506,TO WAR!!! (Not gonna lie this got me kinda hyped haha) goodluck brother!,Look for resistance points and volume,Yeah. I assume you already filed taxes or they would have used your 2020.,0,0,0,0,0,0
235579,"I’m riding my 45c until next week, don’t know how to feel rn",SQ you wanna go green. Just do it.,"I think he had some idea of what he was doing. I read his previous posts and at one point, he was selling covered calls, which I don't think a beginner options trader would even try but what the fuck do I know?",0,0,0,0,0,0
240661,China isn't real,She dropped to 68 and change in PM and is climbing back to 70. No fear.,Pressure forms diomands (hands),0,0,0,0,0,0
241712,You need 100x the share price for them to hold. They have to reserve the cash for you to buy the stock if it is PUT to you.,"They will not.  Call prices generally don't adjust in premarket much though.  What you need to do in the future if you really want it and are afraid of missing is look at the ""ask"" price rather than the auto bid price (which will be slightly lower than ask).  If I bid the ask price I have never failed to get my calls at open.",# TIM AAPL HAD ENOUGH OF THESE SHANINGANS. TO THE MOON!,0,0,0,0,0,0
243012,"When nasdaq goes down 2%, PYPL goes down 6% or more. When nasdaq is up almost 0.5% PYPL still red fuck this POS",And sos reaches market cap of 1B. Legalized my boy Chinese mayday,"Does AMC realistically have a shot at breaking $20?

I'm holding 35 at $13 and I'm tempted to just get out now before it drops back to $8 again",0,0,0,0,0,0
24497,Die TSLA...cya at 400,HOOLLLLD,"So they are not buying bonds, they are stacking cash is my guess",0,0,0,0,0,0
247633,Market is slow as molasses,Agreed I think it will happen Wednesday after FOMC.,Any reason why oil stocks are down today?,0,0,0,0,0,0
248735,We breaking 22.50 APHA fam!! Patience pays off!!! 🚀🚀🚀,"BB no pleas come back, BB!",Can we get some clean energy talk before April 16th pleas?,0,0,0,0,0,0
249316,I never bought AMC.,That's literally this sub in a nutshell. When was the last time you were shilled a stock on here that hasn't already run up 200%?,And buy puts,0,0,0,0,0,0
249960,"I love how the mod team has just fully embraced this apetard land. Is there anyway to just change the name to r/planetoftheapes

At least change the header to like a jungle found a Bloomberg terminal",350 @ $10.49 babyyyyyy LETS GO,I should buy puts on my portfolio...,0,0,0,0,0,0
250672,"Would it be unwise to buy today? Still holding, just wish I had more",What a weird day so far.,"Lol uhhh no. That stock is poocheese till they buyback shares or r/s

Edit: Reverse Split*",0,0,0,0,0,0
250697,"Friendly reminder that AMC was started initially to distract you from GME, and has less short interest than GME, and also doesn't have any change in direction unlike GME (to some kind of e-commerce form with Ryan Cohen). Literal definition of a pump and dump.",That means dead.,you see all the news coming out?,0,0,0,0,0,0
2512,More GME,I have 900 dollars and want to buy gme so bad but know if I buy that it’ll crash so I won’t do that to y’all,"Been adding since April in all 3, plus SAVE.  happy to see them pop",0,0,0,0,0,0
253183,so puts,"Also balls deep in oil, but just buying more of the dip",The deed is done.,0,0,0,0,0,0
254188,"alright boys, TSLA 850c or 800c 3/19",Trying to not jump on the amc bandwagon but that cup looks big..,"I'm either holding on to this bundle of cash or smashing it straight into something before close.  Only problem, I'm 50/50 on whether we're gunna open blood red tomorrow or not",0,0,0,0,0,0
256270,Check again fuckstick,Only gamble with money you afford to lose,because watching CNBC doesn't help either??,0,0,0,0,0,0
256358,Do t you work at a fucking 7-11 or something? Bwagahahahaha,"I’m so upset, I hold those fucking stocks for months and sold them at 10 cause I thought they had peeked 😞",Why u are so obsessed with people that hold GME? All ur last comments is bullying GME holders. Cringe bro,0,0,0,0,1,0
258010,Whaddya mean?,Also hell lot of unnatural downvoting last night anything positive like in seconds after comments posted,I think we need momentum from the casual retails to get the whales to move but the hf scare the casuals away too easily.,0,0,0,0,0,0
259026,If he’s still holding he’s down about 1%.,Look at you. This is what HF want. They want us to fight about whose fault it is to break solidarity. So keep calm and relax.,Did you show her the part where it goes straight up?,0,0,0,0,0,0
259295,"You are totally right and it’s ridiculous. This is a casino and we are here to make money not hold for a meme. I don’t give a fuck about diamond hands, unless of course I’m justifying my loses, I just want to make money. We are better when we share our thoughts and resources to make all the tendies.",UWMC is being put into the Russel 1000 and 2000 next month. I hopped on in hopes that will do something to the share price,"8 days ago, I was absolutely buzzing when GME was 190. Why does it hit so different today?",0,0,0,0,0,0
260465,Dfv is super rich now no matter what and under sec scrutiny.,Hope you do.  Dont puss out,Red days are the best days.,0,0,0,0,1,0
260942,Anvs released positive Parkinson’s results! Two more weeks it will be Alzheimers. Pretty amazing. Finally a drug that works.,Thank you good sr. To bad he didn't follow through,Well I went from being up 200% to being up 12%,0,0,0,0,0,0
263678,Anyone still holding RIOT with me here?,"BULL MARKET UNTIL 2028

BUY THE FUCKING DIP

STAY IN THE MARKET AND GET RICH BOYS!",What exactly is pulling the NASDAQ up right now lol,0,0,0,0,1,0
263877,"I kinda want the GME price to dip a little bit lower (but not much tho) so I can buy a shit ton of shares. I'm still waiting for my wage to arrive, so please wait for me!!",Yes probably,NIO TSLA GO GO GO,0,0,0,0,0,0
264095,??? It's up 3.5% today already ???,Lolol bought at 6% up today?,Strike?,0,0,0,0,0,0
26810,Sometimes stocks go down - the problem is this retarded market convinced everyone that it NEVER goes down because it was green 99/100 days.,Right there with you,"Sir, this is a casino",0,0,0,0,0,0
268895,Random gapup.... did pow announce curve control?,"What's going on with Japanese McDonald's, i've been holding since it went down 4 dollars and it hasn't budged price in like a week, like just 48 even with no movement . Is the Japanese market different?",holy moly spy,0,0,0,0,0,0
270034,TLRY and APHA merger 4/20,"Ark is so 2020.  

Costco and HYFM are now the cats meow",Yeah and bulls are doing well lol,0,0,0,0,0,0
271483,"Every stop loss just hit, such a sad day",SPY $400c 3/17 all the way,"More dumping tomorrow, shit",0,0,0,0,0,0
273183,Just bought $10 calls for august 23. Theta is low af,dude literally i’m down like 40-50% on calls today 😂😂,"Theodore Roosevelt once survived and assassination attempt. He was shot in the chest and then proceeded to deliver a 90-minute speech with the bullet still lodged in him. He opened with, ""Ladies and gentlemen, I don't know whether you fully understand that I have just been shot, but it takes more than that to kill a Bull"". 

Damn, feelin' like Teddy today, bois",0,0,0,0,0,0
273739,UWMC is the only green stock I have right now,God damn wtf did you guys do I was greener than a muthafuk this morning,They will figure out nuclear fusion the day I YOLO on solar tech or something,0,0,0,0,1,0
277678,What’s the YOLO play today ladies and gents,Is that why they waste their time in here trolling their ass off?,"It will probably plummet when the market opens, but PLUG is actually bouncing a bit.",0,0,0,0,1,0
277760,"Word, bro!",Hahaha 1st laugh all night,I am numb to tesla drilling,0,0,0,0,0,0
278631,Wow GME! GO GO GO  😁😁🤩🤩,Mine was created from the fact that when youre fishing you look like youre ready to harry potter the shit out of the water,"I took my stimmy and bought $RKT, $SNDL, and $HUGE calls. Also bought shares in $NKD and $NRZ",0,0,0,0,1,0
27939,Did cramer pull it out and masturbate on tv?,"Thanks for explaining. I get the picture now, and would’ve made more sense years ago right after I took calculus and accounting classes",be happy the market is down. some really good stocks are down 10%+ - nice dips to buy,0,0,0,0,0,0
279541,"“It always goes up” besides this past week with it down 20%. We are here to make money, not start a revolution. By the way, Blackrock, a huge hedge fund is the biggest holder of GME.",TSLA is fuk rn. Abandoned ship,It depends from your personal “Guuh Guh” skills!,0,0,0,0,1,0
280611,I left at 13.27; didn’t like the downtrend for a short term play,Holy shit my portfolio is going up? Inverse dip people are still buying lmao,DIS was putting up a good fight but has now just bent over and spread its little mouse cheeks,0,0,0,0,1,0
285644,The price of steel has increased as well as the demand. Buying shares of $X,My 3/19 15c aren’t looking happy at all right now,AMC Apes are you feeling bullish? 🚀,0,0,0,0,0,0
287641,He can hold overnight,JPow will begin his lying at 2:00 today and yields will bend him over until he admits the truth,They are going to kill it with their electric vehicles,0,0,0,0,0,0
293781,Alright get him off the screen before he fucks up,$TSLA 700 boring AF.  either go back to 850 or drop to 500.,Damn I’m absolutely on fire. Can’t make a bad play if I tried. Up 500% this month and I haven’t even touched GME. Someone peg me or knock me down a peg,0,0,0,0,1,0
297466,Are people switching from Robinhood?,"Isn't it still at a lower rate than what COVID causes? And either way, AZN sucks at making the stuff so it's not like this is a huge block on overall quantity anyways.",SPY EYES & X calls 🚀,0,0,0,0,0,0
297511,I'm not sure I'd blame Robinhood and Onlyfans so much as the circumstances around which people are forced to pursue more risky forms of income generation.,I have some serious loss porn the last couple weeks but at least I wasn’t on margin,395 is the floor right now. Vix isnt super high. If vix starts running and 395 gives itll get worse today. If we bounce off it a couppe more times buy calls.,0,0,0,0,0,0
297652,Anyone here have shares of Gamestop? Some videogame brick n mortar store trying to do more online stuff,"The catalyst is the yields, whether or not it’s justified is a different story",So what's going to happen? Go heavy on Financials? I already got some bac.,0,0,0,0,0,0
298696,"Or if people could give zero fucks.  Honestly I think a good deal of the world has lost interest in Hollywood and movies.  I personally can't stand the majority of Hollywood and most everyone I know feels the same way.  Also I  canceled my cable subscription about a year ago.

AMC is a distraction.   GME is the way.","In shambles lmao i turned into a bull cuz of the rip, held on to calls, now market tanked LOL inverse me","ahhh damn. Well, time to buy some dips",0,0,0,0,1,0
298996,"Bacon, Sausage, or Chicken?",😍,Looks like we averaging down today boyz,0,0,0,0,0,0
299554,"I think there are companies out there like Aurora, Cruise, Zoox, and Rivian who are not yet public that are moving in the right direction. Although yes I'm long TSLA I want to see if there is other untapped value OR if any of these traditional automakers like GM are just blowing hot smoke",If there was no buy pressure at the lower price who are you turning around to sell to at the top?,TSLA PUTS @ OPEN,0,0,0,0,0,0
300872,Lol I agree this whole 💎🤲🏻 For the cause bullshit is wild 😂 investing has never been and never will be a team sport... imagine sitting at a Texas Holden table in a casino and saying “hey let’s just team up against the dealer!”,why sell?,"#[GUH](https://www.reddit.com/r/wallstreetbets/comments/kkc8ev/just_in_case_yall_forgot_this_video_exists/)


*I am a bot, and this action was performed automatically. Please [contact the moderators of this subreddit](/message/compose/?to=/r/wallstreetbets) if you have any questions or concerns.*",0,0,0,0,0,0
302025,Great book. Chapter 11 was my favorite too,I'll SPAC on you....,might willingly pdt restrict myself so I stop making dumbass trades lol,0,0,0,0,0,0
302111,YOLO'd GE. I'll see you apes at the bottom,If they that retarted they deserve that tbh,I felt this,0,0,1,0,1,0
