example_id,preceding_comment,comment_for_evaluation,following_comment,toxicity,severe_toxicity,identity_attack,insult,profanity,threat
561122,SPY 420c 4/20 is really the only play here,"awesome, fuck em","Wow was not expect NASDAQ to do that after seeing it +.5% when I went to bed.

Head and shoulders pattern on the NASDAQ futures, let’s see if bulls have the appetite for all time highs.",0,0,0,0,1,0
563049,and here i thought we were back to stonks only going up,ding ding lets get kicked in the nuts,No I am,0,0,0,0,0,0
567425,wall st ain’t main st,DFV calls expire in a week and he potentially cashes out his shares. That crash will be one of the most glorious things in the history of this sub.,Tesla let’s go bb,0,0,0,0,0,0
570850,"By my calculations if you divide TSLA stock price by 2 pre split you get 3375/2 which comes out to 1687. 

1687 is my price point for TSLA in the coming month. The data above doesn't lie",CHWY making moves 😌,Rotation from SQ to CHWY. 😂,0,0,0,0,0,0
571568,"in these conditions it is bad practice to buy options.  Theta gang been scalping motherfuckers since mid Feb

As a degenerate clown, I must admit here publicly that I bought a lot of shares this week and only 20 or so AMC puts that are fucked.",How is spy hitting an ATH everyday but it feels like a red day,Should I poop or continue to clinch my butt cheeks for another hour in my desk chair?,0,0,0,0,0,0
572892,Expect an explosive amount of volatility after breaking a decades long price channel 😎,Spy’s building a ladder to DMX,Loaded up on more VXX calls this shit is SPOOKY,0,0,0,0,0,0
573937,Call me James Charles Im not stopping til I make me a milly,I'm LOL so hard at these angry ass homeless boomers disliking my comment. Pathetic apes.,fuck just my luck FUBO is red,1,0,1,1,1,0
581712,buy puts next time,"He meant the foreign pussy. You know, the desert kind.",yeah so the question is how to play it?,0,0,0,0,1,0
58212,Bag holders and bots.Total rkt pump and dump.,Same. What a hoe she is.,"Next play - figure out which accounts pumped Weed, RKT, GME second time - find what they are pumping next and buy-in early.

WSB may not be causing the moves alone but there absolutely is some amount of pump and dump happening and retail is getting left bag holding.",1,0,1,1,1,0
585083,"Was down 28% at noon, now I’m only down 7%. If I’m green by close I will probably cry.

Or jerk off idk yet",so shorting?,"Well see, mines ""fell off the truck"" from there.",0,0,0,0,0,0
586380,Fukd,"Gme learend me one thing, Buy the dip","For the love of god, please let that dip be “THE dip”",0,0,0,0,0,0
588475,I saw Mara at like $25 months ago and didn’t bought,Imagine if spy never had a red day ever again,"the vaccines dont prevent covid, they prevent hospitalization and death due to covid",0,0,0,0,0,0
596121,After playing roblox for 30 minutes I can strongly say it doesn't deserve a market cap of 40billion,"Patience my friends. There are 3 things in life you can count on: death, taxes, and JD bouncing back to 100. LFG 🚀🚀🚀",+100% on a Tesla call today alone. That's not counting yesterday. And I still have over a month until expiration. I am TURGID.,0,0,0,0,0,0
596295,"Fair enough. 

Everything only goes up right?",PLTR is such a PLTR,WHAT THE FUCKING FUCK IS NIO DOIN 😳😭,0,0,0,0,0,0
596349,"From what I read, all the blood-clot cases were women. I wonder if they were either on birth control, or just recently went through childbirth. Blood clots are pretty common in those cases, and the J&J vaccine may have just amplified that condition.",P WORD,When it stopped falling,0,0,0,0,0,0
600033,This is actually what every day was like in summer of 2020,"PALANTARDS THIS IS OUR WEEK, SHOW THE WORLD WHAT YOU SMOOTH BRAINS ARE ALL ABOUT I WANNA SEE GAIN PORN ON GAIN PORN IN HERE I WANT THE GME GUYS GETTIN JEALOUS OF US PALANTARDS I WANT A DAILY THREAD DEDICATED TO PALANTIR; I WANT WOLF OF WALL ST MEMES DONE ON PLTR I WANT MILLIONS OF DOLLARS LETS GET IT DONE!!!!!!",Mf better not tweet anything,0,0,1,0,1,0
601184,Fuck yo puts !,Look at the engagement on their daily thread compared to this one. Lol.,I have PLTR 40C 06/18 x 3. I thought I was going to lose my $500,0,0,0,0,0,0
608858,Only people with huge cocks bought this dip,Also me. The bad thing also is that some are not moving at all.,TSLA GREEN DILDO ALERT,0,0,0,0,0,0
609597,"Lmao, price target increased to $5.74 from $4.83!!!!!!!","Correct, but ORTEX is showing similar numbers, and the fee to borrow is accurate",GME somehow still hovering at ~140,0,0,0,0,0,0
612028,I finally sold at the top for tsla calls first time ever feels good to take profits,Stock dumped,IPO is estimated at $250 my guy. If you really want it you should update,0,0,0,0,0,0
613113,when can i buy coin smh. fomoing in at top!,9000,[https://www.youtube.com/watch?v=5FjWe31S\_0g](https://www.youtube.com/watch?v=5FjWe31S_0g),0,0,0,0,0,0
61368,What's holding back OCGN???!!!!!,"Bears, bulls, pigs, what does that make thetabros?","Stop buying Lucid, they haven’t sold cars yet! Don’t waste your money",0,0,0,0,0,0
61955,Do the opposite of what you see here dummy,Too late. I already put my morning profits into something more fruitful long term,I feel like our right the constitutional right to prosper is being violated. Example the hedge funds make a price and magically it goes there while being suspended by hedge funds. They say its over priced and shut us down but u don't see them doing that to car dealers which over price cars by thousands. What happen to the value is the price ur willing to pay for something and being a hypocrite does not seem legal by no means. We have legal right and I think its time to make these million dallor people pay by making laws ourself with the right of voting and people push to make them laws by making the people voice be heard,0,0,0,0,0,0
6539,Soo what are we sayin? after all that gme market will most likely do horrible again right?,Missed an opportunity to be on the 🚀 so now it’s time to hop on! See you guys on Mars! 💎 🤚🏽,"I am not a financial adviser.  This is not financial advice. I am not a cat. I am not an astronaut. I am not a robot. 

My wife told me she bought GameStop stock. I was elated. 
Then she told me she bought it in Stockpile. 

Stockpile. The only thing worse than Robinhood.",0,0,0,0,0,0
67448,Literally no floor in sight for RKT,Bot,Needs more attention first. We’re looking good though!,0,0,0,0,0,0
67665,Anyone Playinh SDC for tomorrow’s earnings report? Volume is growing and lots of short interest I see,"Wake up, get coffee, make random strangers on internet mad, make a few dumb trades. Repeat",LUMN is running again. Pls fly with the eagles,0,0,0,0,0,0
7173,MRK!!!,"If GME opens above 100 it'll rocket, there will be so many naked calls that will have to be filled, all of them owned by hedges",Bot,0,0,0,0,0,0
72270,I think it’s over,Sos is going to catch Riot,So stagnant tho. Idk dawg.,0,0,0,0,0,0
73116,i had a nightmare that i was given an embarrassing flair on WSB,When you bought dips on your entire portfolio 3 times in one day. F,Sos,0,0,0,0,0,0
73459,hell yea,Best way to piss off the suits is to invest in Chinese companies .... there I said it,Fkn treasury yield,0,0,0,0,0,0
73884,Nio sub 40. I keep saying it. My gay heart goes out to all of you. ❤️,What's with all the mega threads? SEC is going to use those against us someday if we don't get rid of them.,Why? What possesses you to want to buy in after massive runs?,,,,,,
75177,Switching to all puts. This market is going to keep falling.,"There was always a pump though, remember PRPL? Lmao.

It just didn't dominate the daily discussion and make this place a shit show like it does now.

The thing that really annoys me is that is an options sub, yet now I would bet the majority of the sub only have shares.",Don’t worry about losing money in stocks. Us poors were never gonna retire anyways so nothings changed,,,,,,
75325,"OOOF this is intense

theyre coming after everything

a lot of knee jerk dip buying is going to happen from people who think this is just a repeat of Friday. makes me feel like we probably go lower in the short short term",They ain't gonna make anything. Volume has been shit since September...,Don't greed brother!,,,,,,
76966,It’s lil intangible robots,Imagine the devastation,"LOL, I'm glad I got it at open and sold near the top then!
Almost 40% profit!

Helped me recover some GME loss :P",,,,,,
77840,GME no,Biden doesn't know what a stock market even is,UWM actually holding strong,,,,,,
82626,The only bond I know is the one between you and me,Stimulus is actually bad now because they are destroying the countries finances and fueling inflationary pressures,If u buy gme then u will look!!,,,,,,
82659,"My Tesla calls expire in may I’m Gucci, -75 percent","Does that ""social media sentiment tracker"" ETF start today?",I bet y'all trumps just laughing in this lil cubbie hole as Joe sleeps the markets,,,,,,
89209,"Honestly, every stock I pick seems to do the reverse fuckery.",Cool story bro. Imagine if it was a real one.,"Sorry, they only paid the mods for 1 day.",,,,,,
90036,Heard JPOW is going to announce new printers that go brrrrr,I'm a gay bear 🐻,"They’re manipulating SKT now, limiting trading. Double down, keep buying.",,,,,,
90767,"I am triple downing, Jay will save us",$PGEN,Lets hope issa bear trap lol,,,,,,
91223,whats going on with UWMC,Corporate debt,If GME goes under $100 I may spend a lot of money,,,,,,
91430,QQQ leaps are so cheap,"Sad but true. Facing another margin call, unbelievable.",Tesla you were better without the s&p,,,,,,
93982,"Hey guys, I think something is wrong with the market.  Can someone hit the reset button?","Honestly the person I'm most pissed off at is that fucker that thought it would be a good idea to throw buckets of money at FCEL at the start of February 

It was me, I was that fucker",I've been telling myself this for 4 days now lol,,,,,,