example_id,preceding_comment,comment_for_evaluation,following_comment,toxicity,severe_toxicity,identity_attack,insult,profanity,threat
580524,makin it rain robux,What exactly is driving their collapse?,"Until they’re banned it’ll never happen 

Three years from now when GME is 13 dollars a share the retards will still be screaming about hedge funds and short ladder attacks",0,0,0,0,0,0
58084,💯,"I'm going to hold my 60 shares of UWMC today, feels like a good bet if others say it's good.",F to pltr being shorted to death,0,0,0,0,0,0
58635,No one told you to buy anything,I didn't even see that!  I feel better now.  At least I'll get a few cents at some point :),Lmao 😆,0,0,0,0,0,0
588624,Likely to see amd bounce back from yesterday's overreaction,"bought the dips at 53, 49, 43 and yesterday. things are going pretty well you could say","the chips are made **mainly** of Chinese rare-earth metals  
and aluminum, natch  .. er .. also from China",0,0,0,0,0,0
593110,Is the other thread still waiting for a squeeze that def didn’t happen when the stock went from $3 > $480?,It is also possible to consent to a possum in certain circumstances,They were too busy being bears I need the loss porn,0,0,0,0,0,0
593333,Will not happen Chinese buy Tesla.,"Lmao imagine being a 🌈🐻 today, couldn’t be me.",TSLA 900C 4/30,0,0,0,0,1,0
594332,"Fly TSLA, fly!",Put 1k into Disney today. Company is too strong for it to be low for so long especially with travel restrictions being lifted soon.,I’m almost wondering if VIAC will recover. Why the hell did it rip so hard from Jan to March?,0,0,0,0,0,0
594899,Kids aren't people,Tsla needs to become the koolaid man. Heard,"Actually it does:

https://www.businesswire.com/news/home/20210413005723/en/Hasbro-Partners-With-Roblox-to-Bring-Roblox-Immersive-Digital-Worlds-to-Life",0,0,0,0,0,0
595818,"Bought some bidu, probably a good catch up play after being beaten down these 3-4 months",Bearish for TSM?,Do they even make money?,0,0,0,0,0,0
599187,"Maybe now, wait for tomorrow open and eventually load up again?!",it ain't even demo day yet! PLTR,AMD good bruh,0,0,0,0,0,0
60041,What you mean dead?  I hope they cashed out!,Fuk this shit!  Long live Cash Gang!,I mean long hold as in it's true sense. Like a year.,0,0,0,0,1,0
601268,date?,"PLTR Gang finally seeing big green for once. BUT keep in mind of the “sell the news” drop we might see. 

Holding 100 at $27.16",1k by Friday,0,0,0,0,0,0
602149,"The lesson from GME is to never marry a stock. You can date it, be fuckbuddies, hit and quit it, but never marry it.",demo is tomorrow no ?,"I'm full to the tits on PLTR but I am worrying...will insiders sell pre demo to profit from this high, so I'd be better off selling at close today...or wait to see what happens around demo time tomorrow at 11...I'm asking my guts and my guts are not responding!",0,0,0,0,0,0
602437,I went all in with PLTR and took J&J vaccine. Roll the dice baby! 🎲🚀,someone has the article where PLTR saved millions for a big oil company ?,"I got some weeklies for it, nothing crazy but that being said 

F",0,0,0,0,0,0
603003,Who else think we gonna have a buncha coin bagholders tmrw?,huh? moron. lol,You held ? Lol,0,0,0,0,1,0
603133,My head fucking hurts. Fuck.,Should I close my pltr 26cc 4/16?,"PLTR finally giving me a little bit of life. Now I’m
Not as down as I was",0,0,0,0,0,0
60748,Bigly is my favorite word to come out of these last 4 years,AAPL calls now.,I definitely just lost $2300,0,0,0,0,0,0
610907,"Was DMX speaking to hedgies when he said 

'Put my shit on tapes, like you bustin' grapes 

'Think you holdin' weight, than you haven't met the Apes'

?????????",Been saying that all week. Bitch still goin up.,Once Europe stops fucking up the vaccine oil will rocket.  Late summer is my guess as the time to sell.,0,0,0,0,1,0
61472,10.36,Yea bc I’m stating the obvious 🙄,Alexa play It’s a long way to the top AC/DC,0,0,0,0,0,0
617246,Cnbc: “we’re bearish bc today is red” 🤡🤡🤡,Alexa play Bruce Springsteen - I'm Goin' Down,120,0,0,0,0,0,0
65030,Bear market is coming.,We’re trying,"They both puppets, just 1 had balls and was entertaining and other is half fucking dead. K st runs everything",0,0,0,0,0,0
65203,"$Forward has a very low float and will 
 fly with volume. Very easy money if people buy","Bro Ann Hand, look what u guys did. LMAOO","See you can just buy spy calls, there will ALWAYS be some market makers ready to pump us back up every day every dip. They have your back and they have your best interest in mind",0,0,0,0,1,0
67448,Literally no floor in sight for RKT,Bot,Needs more attention first. We’re looking good though!,0,0,0,0,0,0
69360,UWMC I told you motha fujkers and you called me a bot eat your own shit,Nok is so safe and stable at this price.,"Everything tanking ahead of senate stimulate vote.  Buy the dip, it’ll pay off going into the weekend",0,0,0,0,0,0
69828,NCR moving on that Morgan Stanley guest speaker spot.,"Gary black00 is on the tech hype train - sees tech weakness as result of big funds erroneous belief that inflation is back. Newsflash: every economist at the fed agrees that pressures around the US are deflationary, not inflationary. 
Add that to stimmy getting delayed more by cocaine Moscow Mitch, which in turn delays any infrastructure deficit spending, and tech’s about to do another lap of the moon.",People had the warmup round with gme and still didn’t take profits on RKT. You deserve to lose money if you don’t take profits on a +70% day.,0,0,0,0,0,0
70297,DFV needs to do his patriotic duty and kill the GME monster he created by selling. This sub sux ass now,"Bullshit, what’s the SI % float?",Yesterday I sold my RKT calls at 9:45,0,0,0,0,1,0
87771,Anyone jumping on SKT today for the Gains then back into GME.?,"Ber r us

change Wall Street bets 

To wallstreetbears until further notice","I’m bagholding RKT at $33. Is all hope actually lost? Might just sell and pray to UWMC to restore the tendies the locust has eaten.

Edit: glad I sold some at $27.63 now",0,0,0,0,0,0
88690,"Eat my dongus you fuckin nerd.

*I am a bot, and this action was performed automatically. Please [contact the moderators of this subreddit](/message/compose/?to=/r/wallstreetbets) if you have any questions or concerns.*",You should have got in when it dipped to 19's few minutes ago if you want to play the pump.,$SPLK  🚀  🚀  🚀  🚀,0,0,0,0,0,0
89416,Nah,Can Amazon go back to at least 3300? This is just fkn sad now,Puts will look juicy by EOD,0,0,0,0,1,0
90767,"I am triple downing, Jay will save us",$PGEN,Lets hope issa bear trap lol,0,0,0,0,0,0
92672,Halp,What to see how algos work - look at the GC contract and how desperate they are to keep it above $1700 lol - if $1700 falls then watch out,"Nope, they want to be with you. Glad to see them go, they all wave some weird fascist flag that makes us look bad.",0,0,0,0,0,0
93982,"Hey guys, I think something is wrong with the market.  Can someone hit the reset button?","Honestly the person I'm most pissed off at is that fucker that thought it would be a good idea to throw buckets of money at FCEL at the start of February 

It was me, I was that fucker",I've been telling myself this for 4 days now lol,0,0,0,0,1,0
94747,Same 🙌,"Don't sell, I'm seeing some bounce backs",alex karp show them who the big boss is 😈,0,0,0,0,0,0