example_id,preceding_comment,comment_for_evaluation,following_comment,toxicity,severe_toxicity,identity_attack,insult,profanity,threat
101241,"Jay basically affirmed that bond yields will keep rising due to temporary increased inflation later this year, hopefully market will retain this information and keep it in mind or we're gonna be in for a rough time.",*this is fine*,"I don't feel so good, mr. Musk",0,0,0,0,0,0
103504,At first I was like fuck this guy but a hour went buy and I’m in more pain lmao 😂 maybe your right,"psst.....hey....hey kid....you....yeah you....come here...

u wanna see a circuit breaker?","*buys a “dip”*

Autistic Me: Wanna see me do it again?",0,0,0,0,0,0
107530,If you're pretty sure then buy puts :),What's the difference between value investing and bag holding?,Bro just go on vacation. Right now is not the time,0,0,0,0,0,0
10901,Beep bop biip,It’s being so lame,How much longer before PLTR is trading at zero,0,0,0,0,0,0
110584,Didn't even know there were other sectors tbh,"Lolz and all the ""This stock has dropped 5-10%"" alerts in the past 60min.... But not really. 😰",Was seeing a lot of people saying they’re out of the market. On top of all the people saying they bought puts.,0,0,0,0,0,0
112973,"This, time to get calls",I cannot believe gme is green😐,If you didn't buy aapl calls at 118 I think you hate money,0,0,0,0,0,0
113182,^^ this. This is a pretty bullish EOD,That’s why no one will remember your name,Fuck I hope x),1,0,0,1,0,0
122365,Where are all the bears from last night? Y'all back in your caves now?,Up 10%,I hate that I fell for this RKT bs.,0,0,0,0,0,0
122973,XPEV TO THE MOON BABY,The only honest comment,Do it be a legend,0,0,0,0,0,0
123713,Bull trap or am I smelling some gains? 🚀,May i ask why?,Be hella wary when WSB is overconfident. Wonder how many ICLN 3/19 40Cs are expiring worthless.,0,0,0,0,0,0
128146,Needs some kind of catalyst.,What is a GameStop,same with my etsy calls,0,0,0,0,0,0
129162,how retarded am i? Im still not green on GME,"Alexa, play Pump It by the Black Eyed Peas",GME earnings in the 25th is gonna break the market,0,0,0,0,0,0
136063,"WELCOME NEW GENERATION OF GME BAGHOLDING 

GUESS ITS NOT AS EASY AS TIK TOK TELLS U IT IS HUH",Tell em he should’ve bought Deere! 😂,Everyone should have them by now,0,0,0,0,0,0
13729,"Even though this is exciting, ya'll have to realize this is not sustainable. I'm pretty sure a whale caused the spike in price. You guys make up like 1% of GME, so you won't affect the price as much. We're playing their game. Please put a trailing stop loss or something so you can get out with some profit :(","If there are no sellers, it shows as $0.01 until a price is listed.",Because you’re losing faith,0,0,0,0,0,0
138055,Sold too early last week so naturally I'm going to hold way too long this week,What’s the Robinhood number for refunds?,"That's a great question. It's an important question. Thanks for asking it. As I said in my opening statement, I appreciate you inviting me here to talk about this today. It's something that hasn't been discussed enough in my opinion. In conclusion, we're out of time.

*I am a bot, and this action was performed automatically. Please [contact the moderators of this subreddit](/message/compose/?to=/r/wallstreetbets) if you have any questions or concerns.*",0,0,0,0,0,0
144484,"A diluted bill passed the Senate, which was going to be the biggest hurdle, now it goes back to the house which is DEM controlled. I'd say its 99% that it will pass.",Why we dumping,"Maybe if we just believe hard enough, it'll come to pass.",0,0,0,0,0,0
147415,Dm now u win,UWMC is the funniest shit. Legit a decent company with good fundamentals and WSB’s retardation just killed it,I think it’s cute how the market is trying to rally. SELL THAT SHIT.,0,0,1,0,1,0
148343,Will you actually eat poo,Crazy part is. He co-created the show billions.,"You must be new, Boeing plane crash = BA up 5%",0,0,0,0,0,0
149426,"It’s fukken oversold AF rn dude. Unless you have the attention span of a moth, which it seems you might, you be hard pressed not to make massive gains in a fairly short window, relatively speaking..... IMO obviously",QQQ gap up right after closing down 10% from recent high? BULLISH AS FUCK,r/hydrohomies,0,0,0,0,1,0
150084,Cathie Wood is gonna have an amazing redemption ARK,"Tesla stock has always been playing a long game of who will be left bag holding. 

Did anyone else laugh when Cathie threw out her $2000 price target?",Bank of America is DED,0,0,0,0,0,0
150131,MORE. MOOOOOOREEEEE,"Hopefully they got something that will make it fly at 1.  I got shares, so not rooting against ya.","Was starting to doubt my strategy of buy the dip as the Nasdaq was sliding yesterday afternoon. Got myself into a little pickle, but the overnight gains put me way up.

In conclusion: STONKS GO UP",0,0,0,0,0,0
150240,Volume is now up to 5.1 million on DASH. doesn’t make any sense. Do people not understand lockup period expirations?,Someone bought puts,Correct,0,0,0,0,0,0
151695,yeah its called being a gay  🐻,You expect me to believe we're not going to dump? Ight,DASH is a garbage stock. Why would anyone buy dash when Uber is right there.,0,0,0,0,0,0
153312,where are the pussys that are selling. I know you are in here. Fucking leave. Go watch your wife fuck your neighbor!,Omg I may actually be able to drop off some bags 😭😭😭,"Lower lows, lower highs for SPY perhaps?",0,0,0,0,0,0
154612,"PLTR, am I a cunt to you or something? Break 24 and stay there for fuck sake.","i know as soon as i buy back these covered calls on TSLA, its gonna dump.


Trying to diamond hand for yall.",Someone give me a play dammit,0,0,0,0,0,0
156038,"Just a reminder for all you TSLA bears. If this last year has taught you anything, you never bet against Elon.",Just copped some 195s fuck it,Selling GME puts is literally free money,0,0,0,0,1,0
159669,I’m gonna $CUM!!!!!!!,I have leaps. They were in red long before this correction.,"I feel like any minute now, most of us are going to catch Rug Polio.",0,0,0,0,0,0
169031,5 day chart looks so sexy.,They are already in Europe I believe.,"I have no financial advice but all I’m saying is, do we really have 9 mil apes strong!? If so, prove it!! LFG",0,0,0,0,0,0
171021,Same here. It got mixed up in the craziness last month but they are a good company.,20,"So my 20c are now 160c, right?",0,0,0,0,0,0
171465,"How to destroy America's economy:
Buy Gme hold like a ape..
Mother Russia and China see, how easily America is sinking.. they buy a shit tonne of Gme
Stimulus straight into Gme.
Ryan Cohen tweets.. mass fomo ensues.
Wait... nuclear financial explosion.",I think like 1:30-2pm you know. Start watching CNBC at 1pm they have Rick on it talking for sure.,"FYI: 

RBLX ticker has been added to almost all now.",0,0,0,0,0,0
17708,Feels like every day we dump in the am and then rally all day. One of these times it's gonna dump and keep dumping.,"Holding as we speak, cock in hand, finger in ass",Wishing i had an exit strategy,1,0,0,0,1,0
177868,Ya and when its up 80% TSLA (which is pulling it up) is probably up like 160%,"Its ok. Inflation will save me.

Lie down. 

Try not to cry.

Cry a lot.",They think it’ll throw off “the algorithms”,0,0,0,0,0,0
177960,Ok what the fuck,"Theres no denying now. We're in a bear market
🤡🤡🤡",Think we just need a healthy 20-30% correction to ever moon again.,0,0,0,0,0,0
179798,Yikes. Just double down now,$45.25 only interested in buying it to make money on hype.,Why? Its basically minecraft,0,0,0,0,0,0
180993,Seriously..where do you guys see fme going 2nd time around?,HAS IT BEGUN?,You guys really did come for me,0,0,0,0,0,0
181207,Have a handful of 10c for AMC and idk if I trust holding through earnings I can't let myself get greedy,Depreciating asset. The first isn't as good as the last.,"Fuck, I already regret selling my Nvidia puts 🤡",0,0,0,0,0,0
181959,Maybe not by today but when theaters open sheeesh,"Rough theory is change in the DTCC rules, so some may be exiting in advance. The option volume spikes this week and next and then drops off at the end of the month before spiking again in April. I don't think any HF's want to play earnings on this.","all i had to do was nothing. i had 50 shares and sold when it dropped back down to my break even, watching life changing gains disappear. all i had to do was nothing and i would’ve been right back where i was. depressed now but realistically if i didn’t sell at my break even of 95 i definitely would’ve sold at 70 or 45 ... this game ain’t for my emotional ass",0,0,0,0,0,0
184729,"Ya okay.

Keep fuckin telling your self that.  This shits crashing",Are y‘all sure GME will rise again?,"> GME

that's not true 🥸",0,0,0,0,0,0
185218,"It's a GME catastrophe, as one would say",Bye the dip before GME takes off!! 💎💎🚀,💎🙌,0,0,0,0,0,0
186815,"#lord high in heaven, pls crash AMC so my puts can print!

Amen 🙏","It’s always gonna be like that, each new rise creates a new round of holders lol",If meme stocks die today we gonna have an incredible bull run 🤤🤤,0,0,0,0,0,0
187259,Holy fuck I just spit all over my computer,That’s 6 halts fir those of you counting at home,This happened because someone posted about Cede and Co.  Barking up the wrong tree,0,0,0,0,0,0
187640,"This is nuts! Whether or not you’re in on gme, this is fun to watch",you stupid fucking cultist do understand how percentages works right?,The real bag-holders are the friends we made along the way.,1,1,0,1,1,0
188291,"#HOLY MOLY!!


*I am a bot, and this action was performed automatically. Please [contact the moderators of this subreddit](/message/compose/?to=/r/wallstreetbets) if you have any questions or concerns.*",They really think 🦍are too dumb to notice that the GME and AMC drops are at exactly the same? Like we’re all in here you dumbfucks.,I feel like I just railed coke then laid down to sleep. So much going on rn AUGHGHFHFHF,1,0,0,0,1,0
198242,Yet they plan on diluting even further,I think people are just mad that you keep saying DFV sold his position even though you clearly have no proof of that actually being the case.,Disney apple,0,0,0,0,0,0
200820,so that means moon,"I’m getting called a Shill again for posting on my new Alt. 

That’s how you know the GME holders are scared 😱","ok, thanks! I will take a look at it, not buying in yet",0,0,0,0,0,0
201941,Dump your unemployment into GME and we can run them completely out of business. For realz.,when will rblx have options available?,thats slow as fuck. I go by Richter scale magnitude. 10k becomes 100k becomes 1 mill. 2 moves is all it takes if you only go for 10 baggers,0,0,0,0,0,0
202896,Lol let me check it out,My 5 $65 RBLX doing ok I guess,You think Lizzie O'Leary got matching drapes?,0,0,0,0,0,0
203279,Hello noodles..,"I don’t actually believe it will hit anywhere close to those figures, even if there was a massive short squeeze - I’m just trying to get a sense of why it continues to get pushed if the original thesis is seemingly moot now.",Please god give me a little GE pump when this boomer goes on CNBC I really need to dump this bag,0,0,0,0,0,0
206329,I like my Stream Deck.,GE leaps? Seems like a no brainer should see a reversal from this oversold territory soon,We need some backup to get the hedgies the lesson they deserve!!,0,0,0,0,0,0
206460,Bought in at like 45 lol. Never sold tho,Loony bin.,Up to you. Just watch the BC price. They are pretty tied together,0,0,0,0,0,0
207499,Deep OTM calls after a face ripping green week? You do you lol,Last chance to get in snap and AMD at a decent price 😳 don’t get too caught up in GME,Hold on PLTR!,0,0,0,0,0,0
209034,"I thought it would crash last week around $130, boy was I wrong",I’m more of the homoerotic naturalist. How do you feel about getting some hot 2-inch dick pics?,No I’m long,1,1,0,1,1,0
209919,Same broski,Undercut the price by around $5 and it will fill.,Drill,0,0,0,0,0,0
210774,Lemonade holy fuck.,Biden to sign stimmy this afternoon,No chance.,0,0,0,0,0,0
212272,How much?,After holding FINV for the past month I can’t believe I dumped it yesterday. Oh well I rolled it into some RBLX gains but still kicking myself a bit 😭😭😭😭,AAPL is 6% of SPY,0,0,0,0,0,0
213378,where's the sell button?,I'm inversing you and feeling bullish,$MSFT 🚀🚀🚀,0,0,0,0,0,0
213783,Nothing wrong with holding a bag of weed IMO.,Jim Cramer could suck a tennis ball through a garden hose,Aapl isn’t trying to revolutionize anything new. They only care about making sure once you buy an apple product it’s hard as fuck to get away from it,0,0,0,0,0,0
218074,I see snek awards I post 🐍,Reminding myself to buy the dip!,Breaking news: Jim Cramer and vlad tenev are romantically involved,0,0,0,0,0,0
219798,Buy calls. Plenty of opportunity,"Here, take a downvote!","you can also see it on yahoo, go to the fullscreen chart, then settings and enable extended hours",0,0,0,0,0,0
221137,ɴᴏᴡ ᴘʟᴀʏɪɴɢ: [Kesha - Die Young (Lyrics)  ](https://www.youtube.com/watch?v=5EBALIhQ0Tg) ─────────⚪───── ◄◄⠀[▶](https://www.youtube.com/watch?v=5EBALIhQ0Tg)⠀►►⠀ 2:22 / 3:34 ⠀ ───○ 🔊 ᴴᴰ ⚙️,"Yes a need to look into that.  By the way, I remember you told me you loved me two days ago.  Thanks for that",Brother ! at last !,0,0,0,0,0,0
222694,I like your ass.,Thanks,Bulls are so dumb lmao 🤣 sTorKz oNLy gO uP,0,0,0,0,0,0
224527,Gimmee that sweet confirmation bias🤞🚀,"Lol oh no please, not another dip 😂","I have been rocking QQQ 325 4/16

To Valhalla we go, brother!",0,0,0,0,0,0
224531,Told y’all penn and DKNG too strong,Sell it for a profit,Looks like the kids are eating good today.,0,0,0,0,0,0
228959,RIP to the bears that saw bonds sky rocketing and used that to justify TSLA puts 😂,GOEV calls printing,Can we talk about mvis? Wooo!,0,0,0,0,0,0
231134,Name a legitimate tech IPO that has lost money long term.,God im bleeding so bad. Im just tryna outtrun this fucking fed call today WTF howwwww 🤢🤮,"Bulls gonna run forever!!!!

$PLTR - Positive, $TLRY - Positive, $AMD - About to be Positive!

🐂🐂![img](emote|wsb_emojis|bull)🚀🚀🤣🚀🚀🤣",0,0,0,0,1,0
234902,lmfao 👀 running into close,So going from the 20s to the 40s and back to the 20s in a matter of weeks is hardly moving?,Why don't FED go public just like Bank of Japan. It would be infinite money hack and Jpow could fuck bears personally.,0,0,0,0,0,0
235725,Hope for a spike next week. That'll send IV skyrocketing again,"Come on tech, green at the last minute!",Same g,0,0,0,0,0,0
239924,Looking like AMC is finally going green for me,"Am I? The market actually opens at 1:30pm here in the UK today, when normally it opens at 2:30pm.",MODS!!!!,0,0,0,0,0,0
240829,"Only 250,000 shares borrowed for gme 👀",Premarket teasing me like this girl I know.,This is the way.,0,0,0,0,0,0
240977,*knock knock* ✊ is this the #BB chat? LETS HAVE A DAY,NOK 🚀🚀🚀🚀🚀,"MVIS looking nice and sleek this morning. If I could choose only one company to invest in, it'd be this. Their Lidar sensor is going to be in *everything* in the next decade. Coolest technology ever and loving that they're getting real orders and movement.",0,0,0,0,0,0
241984,There is no AMZ stock symbol dumbass. Nobody knows wtf you are talking about.,Ummm but is it ?? Lol I’m still at a loss and it’s moving like cents lol,Finally,0,0,0,0,0,0
244657,Squares strength relative to the rest of the market and tech is crazy,apes together stronk,ffs you guys need an AMC thread jeebus,0,0,0,0,0,0
249739,Hello AMC my old friend...,When do businesses start getting their bailout money. I swear that money goes right back into their stock and is why stocks have been flying.,$500 left over whats the move,0,0,0,0,0,0
250697,"Friendly reminder that AMC was started initially to distract you from GME, and has less short interest than GME, and also doesn't have any change in direction unlike GME (to some kind of e-commerce form with Ryan Cohen). Literal definition of a pump and dump.",That means dead.,you see all the news coming out?,0,0,0,0,0,0
255368,RUBY looking nice today too. Just got a cancer drug approved.,2%? Really?,I doubled down,0,0,0,0,0,0
260465,Dfv is super rich now no matter what and under sec scrutiny.,Hope you do.  Dont puss out,Red days are the best days.,0,0,0,0,1,0
26054,SOON MAY THE TENDIEMAN COME TO SEND OUR ROCKET INTO THE SUN,You can tell Rick Rieder was skiing because of his goggle tanline,"I realize that the AMC squeeze goal is $12 on Friday, but doesn’t anyone know the realistic ceiling of it is held to $12?",0,0,0,0,0,0
261135,🏳️‍🌈🐻 ring leader Jerome set to tank the markets again today isn’t he,"> Remember to not talk about any stocks with market cap under $1 billion, no SPACs, and no Crypto. 

Are these rules strictly for these megathreads or have these been implemented across the entire subreddit?",Don't talk about the obese talk show host like that,0,0,0,0,0,0
263278,"vxx falling with red candles on spy

something weird here","Thinking JPow comes out tomorrow on presser dressed as leprechaun throwing gold or coins at people, this would obviously be bullish",FAANG,0,0,0,0,0,0
266963,"$NIO consolidating in the mid 40's range for a few days already.

Any news and up at least 10%. Free money IMO.",There’s never a free award around when I need it,"FELLAS, IS IT GAY TO KISS YOUR OWN WIFE ON THE DICK?",0,0,0,0,0,0
267038,"One day I will own a digital museum full of NFTs worth millions of dollars and hosted on a Roblox server. 


My prized possession will be the original GUH video, valued at over $75m",you are a ray of light in the infinite shit infested cavern of apes,All that red got me watchin shrek just to see sun greeeen,0,0,0,0,1,0
267142,"If the GME thread were an actual physical space, would it smell like a GameStop?",I don’t think tickets to a play cost that much.,There’s that wall of people who bought AAPL at the split again,0,0,0,0,0,0
26731,"Trailing Stop Loss (%)

or Trailing Stop Limit (%)",spy is not having a good day.,AMD puts every morning for the last month could have made me rich,0,0,0,0,0,0
267513,"In a gentle way, you can shake the world. Just so you know, the correct spelling is [Gandhi](https://en.wikipedia.org/wiki/Mahatma_Gandhi).", I will laugh my ass off if we have a bear market at the same time as the economy recovers.,FOXCONN to build Rival CHINESE EVs in US (not AAPL).,0,0,0,0,1,0
267621,I thought while the big boys go away for lunch the prices rise cuz retail buyers buy but it’s whatever volume is low today too in a lot of stuff maybe tomorrow bulls will wake up and hit buy with their stimmys lol,SPY puts about to print.,Just buy puts whenever he speaks. Ez,0,0,0,0,0,0
270141,"They pressed the wrong button and laid off 10,000 people","Lol it's almost always at all time low on a 1 year time line. UVXY mechanically loses value over time, no?

I agree JPOW might spike it, but using ""it's at all time low"" as a reason seems like a horrible idea. Please correct me if I'm wrong.","No way! They were priced in the moment it took off last week. Too expensive, not enough risk/reward ratio in my book",0,0,0,0,0,0
27027,RIOT dead or worth buying on the dip?,"this is the time to test how much determination we have. we have to try to think weeks out, assuming u don't got FDs.

this is the MM's way to get back at retail for thinking crap is on easy mode.",can you all short squeeze my pp?,0,0,0,0,1,0
270550,"So I owe $2000 in taxes.  Just going to send $1400, they won’t mind right?  I paid $600 last year.  I assume they will see where I am coming from?","Yeah no kidding, just a brutal day all around.","Powell: There’s no inflation, we aren’t raising rates til 2023- bears r still fuk.                                                           Analyst: We interpret “r” to mean “were” therefore sell everything.",0,0,0,0,0,0
270830,What stocks benefit?,"If the market crashes just load up on boomer stocks, you'll be grand if you just hold for the next few years","I am sorry I made fun of you earlier, GMElords. Please can you remove the hex from my portfolio?",0,0,1,0,0,0
273409,What happened,"The stocks should be like my local casino, have to pay out 91% to keep their gaming license.  🤔",it will hit 17 before it hits 25,0,0,0,0,0,0
275362,Which one of u bought my stocks? >:(,"posted this in the other thread but the more i think on it, the more stimmy this week looking bearish to me. we are at ATH and about to have a wave of buyers and its gonna be mm that sell to those buyers at the top. after that mm will wait patiently to scope cheap shit up on the dip as the panic selling from $1400 dummies continues and buying runs dry. dont know how it will work with meme stocks, i could actually see market dipping with that + fomc but meme stocks (mainly gme/amc) being left to do their thing today and tomorrow. or maybe they'll dip even further than the market. who knows. just using my 5 brain cells to think for once.",That thing is 1.64% rn.  JPow has to say something interesting today.,0,0,0,0,1,0
277678,What’s the YOLO play today ladies and gents,Is that why they waste their time in here trolling their ass off?,"It will probably plummet when the market opens, but PLUG is actually bouncing a bit.",0,0,0,0,1,0
277951,"rate hikes are priced in, are we in growth mode? haha noooo jerome wants CASH! they’ll find another excuse to add risk off to the speech. bad day today? probably.. bad march? better get some monthlies crack head",It can close on Friday between 15 and 17 and we’ll both be screwed lol,#GME,0,0,0,0,0,0
278900,People fucking with vxx calls today? 13.50c 3/19,Teeth falling out means you’re anxious that you’re ugly. Ugly ass.,They are going to be condensed into an ultra-diamond,1,0,0,1,1,0
280611,I left at 13.27; didn’t like the downtrend for a short term play,Holy shit my portfolio is going up? Inverse dip people are still buying lmao,DIS was putting up a good fight but has now just bent over and spread its little mouse cheeks,0,0,0,0,1,0
283125,"Godspeed, autist...",And I thought I was averaging down.,I did that but half about two or three weeks ago. Just waiting to get back in. Not sure where to go with it. Ever since apple had the 110 billion quarter and dropped 4% I sold. Hahahah,0,0,0,0,0,0
287481,Volkswagen doing good because no options buying?,RKT at 26 EOD would be great,Hog,0,0,0,0,0,0
287641,He can hold overnight,JPow will begin his lying at 2:00 today and yields will bend him over until he admits the truth,They are going to kill it with their electric vehicles,0,0,0,0,0,0
287760,Frantically invests life savings,"To qualify for a company's dividend payment, you must have purchased shares of the company's stock before the ex-dividend date. You can continue to hold your shares after the ex-dividend date or you can sell them on the ex-dividend date and still qualify for the dividend payment.",That could be fun.,0,0,0,0,0,0
290662,BB 🚀,JAY MF POW!! 📢📢,What's going to happen after Powell at 2:30?,1,0,0,0,1,0
296489,When does Jpow speak today? I’m curious because my calls expiring Monday are dead as fuck rn,I bought a leap last year. Was going to sell before earnings,Through Gamestop all things are possible,0,0,0,0,0,0
298401,"I appreciate the effort, thanks","just wait till you realize the narrative you think youre a part of is really ""the suits and hedgies"" fucking you. That's the real doozy.

&#x200B;

Youre talking about groups of individuals with decades of experience, graduates of ivy league schools with backgrounds in physics, engineering, math, compsci, etc. 

&#x200B;

These dudes arent retarded and they havent lost systematically in over 100 years. Do you really think they're incapable of hedging and adjusting their strategy or do you actttuallly believe that a bunch of noobs with 2k in their account are moving markets? It's a liquidity scam and the average american is the mark- in just one day they managed to transfer roughly 40% of the direct stimulus payments to americans to themselves instead. 

&#x200B;

Just because a bunch of randos on reddit use terms like ""hedgies"" and ""suits"" doesnt mean there is some conspiracy. It's just people doing their jobs and when millions of idiots are willing to buy dogshit stock at inflated prices it is literally their duty to make that market and hedge around it. They're not targeting wsb noobs, wsb noobs bent over and offered up their financial assholes for the taking. Why wouldnt they dip the tip in?","Pre-recorded speech, from what I gather",0,0,1,1,1,0
304346,I agree with the Fed. Stick built houses are crap not worth what was paid anyway. And the country is fat as a cow. Food is plentiful.,I legit think SQ will be worth 5k a share in a few years and I cant stop buying at these prices,YES $UPST KEEP GOING,0,0,0,0,0,0
305850,Cathie Wood is a strong woman. Just look at the heavy bags she's holding,Which ticker?,"I’m gonna buy some bonds, hopefully that shit will tank. As per usual for a financial instrument purchased by me!",0,0,0,0,0,0
307499,Wheels have always been solid choice,"SIL exposes you to miners, otherwise if you're looking to \*actually\* invest buy the physical.",Just got 1 more share. Im flying commercial but still going to the moon,0,0,0,0,0,0
309924,I Definitely agree with you on that.,"BOGDANOFF E DEE DIT 

E BOGHT?

E WENTO-OL EEN

DAMP ETT",Fuck you theta gang.  You'll get screwed eventually.,0,0,0,0,0,0
310431,"UPSTART COME DOWN FROM MARS

GOOD FOR DRIVING CARS

WHAT HAPPENS WHEN MY PUTS PRINT THO",You know at this point Im better off looting people on the street at 1am than do this shit.,Is UWMC a legit play or a distraction? Asking for a friend,0,0,0,0,1,0
