example_id,preceding_comment,comment_for_evaluation,following_comment,toxicity,severe_toxicity,identity_attack,insult,profanity,threat
312029,I DECLARE BANKRUPTCY,Lmao SPY dove straight down just now and isn't stopping,JPow didn’t get the stimmy check to buy more ink for the printers 😓,0,0,0,0,1,0
312555,What the fuck? High volume sell off out of no where.,Meme. Dead soon.,Unironically lmao.,0,0,0,0,0,0
313751,Aaaaand....it’s gone.,Did SQ kill someone with a treadmill too goddamn it,It’s typically the opposite of whatever you’re holding,0,0,0,0,1,0
316461,Today = no Vaseline,The entire market is fucking hemorrhaging,Imagine putting your money in bonds lol,0,0,0,0,1,0
316569,Taunting in the GME thread might become my new hobby holy shit they’re fragile,"everyone already spent their stimmy, it’s over",Down $1.30 now :) down $4+ for the month. Lost $3000 alone today,0,0,0,0,0,0
318752,Big if true.,Do you routinely comment your opinion on topics you know nothing about?,"They get all 4, fuck that. 

Just one Warlock, that's all I'm saying",1,1,0,1,0,0
318765,You gotta research the dd posts for your answers because there are at least half a dozen reasons.,The calm before the storm,Amc for Harambe,0,0,0,0,0,0
318889,I might have to pay for cable television for once,youR muMs a hOE 👍🏼,"How is my portfolio 
Spce TSLA AAP crsp pltr cciv roku bft crsp abnb",1,1,0,1,1,0
319955,All these tards playing options just to go broke?,After we crash the market today we ll take our GME gains and buy the fucking dip.,Boomer computer,0,0,0,0,1,0
320547,FRIDAY FUN AMC 🚀 LETS GO APES!,?,"Yup - I feel like after yesterday, options are at neutral and MM will keep it this way. Hoping for the rocket ship Monday.",0,0,0,0,0,0
321114,/r/iamverysmart,I'm efficient and use it for both,"Sometimes at the rodeo, a confused bull will just calmly walk out of its pen and look around trying to make sense of what’s going on.",0,0,0,0,0,0
321288,"UWMC UWMC UWMC

Wolololololo!!!!!!!","Dude let the shares go. See where they settle Monday. Rebuy and sell more covers on them. Great play, nice profits.",RISE FROM THE GRAVE PLTR 🙏🏻,0,0,0,0,0,0
323592,Rotation back to technology,Saw news on CNBC that China is banning some folks from driving a TSLA. How big of an impact this could be?,!remindMe 5 days,0,0,0,0,0,0
32449,Agreed but I bought them yesterday 😩,We're all one senate covid relief bill failed vote (couch Joe Manchin cough) from getting ass fucked,RISE $BB YOU’VE BROKE MY HEART ENOUGH,0,0,0,0,1,0
325152,GREEN GREEEN GREEN HAHAHAHAHAHAHAHAHAHAHA,"sorry bears, i bought puts...","Right?! Tempering my expectations, as usual",0,0,0,0,0,0
328503,MMs looking for bag holders....,NIO doing it’s thing,"'Market is crashing'  
  
'We are so fucked'  
  
'Circuit breakers today' 
  
##Y'all are uninvited from the barbecue.",0,0,0,0,0,0
335059,lol somebody REALLY didn't want to get assigned those $14 calls.,"There's no logical reason BB would sky rocket, if anything it's a long-term hold or short-term sell. Not financial advice, am dumb ape.",DM meaning dungeon master? yeah of course im a bagholder. shoildnt i be committed to the stock i invest in? ie money where mouth is?,0,0,0,0,1,0
338508,What do you mean by listed? Isn't the ticker available to buy on the nyse?,I hate it because I really do like RKT in-spite of its WSB meme status. The second it hit $30 I sold and have re-entered in the 23-25 range but it’s going to be a long hold now before it gets back to $40.,Pour one out for the retards who sold the bottom last week,0,0,0,0,0,0
344027,Don’t follow buffalos off a cliff,Don’t forget tmf good hedge with spy,D i l u t i o n,0,0,0,0,0,0
348460,Crazy how little volume is moving it would love to see it catch on around here it would close 140+ with nothing I bet.,Today sucks,10+ years soon,0,0,0,0,0,0
348903,Which puts you getting?,"Don't get married to a stock, they don't even know who you are.",Vix sux dix,0,0,0,0,0,0
349002,They can take their whole $1.11 and buy some tissues.,AMC cucks... don’t check ur portfolio today,Holy fuck 😞,0,0,0,0,1,0
351156,"""Boring day""

*SPY up 3%*",Gotta take profits homie. Quit being greedy,It’s trash,0,0,0,0,0,0
354062,Can’t see it. Does that mean you don’t know?,"There is litterarly nothing confirming that Amazon were about to buy AMC - it was just speculation. 

dude your logic is so far from reality it scares me, if anyone were to buy AMC it would've been when they were on the brink of bankruptcy thats just how it works. I'll leave this now because there is no discussing with you. 

&#x200B;

Good luck and I honestly hope you make money I really do.",Are people in wheelchairs now retarded automatically?,0,0,0,0,0,0
357492,Petition to remove the buy and sell buttons on all brokerages to be replaced with the donate button,Yeah since the end of last week it’s been a blood bath,Profits is profits!  Congrats.,0,0,0,0,0,0
359179,"How are you selling eggs for $2 a dozen? 
How many hens do you need to make a dozen a day",What...always dump....are we playing here,Small green days followed by bigger red days leading to a monthlong bleeeeeed,0,0,0,0,0,0
360029,Hardly green,YES SAVE ME MUSK DADDY. PUT THAT BIG GREEN DILDO BACK IN,Spy and qqq are both green tho?,1,1,0,0,1,0
360560,Apple 125 EOD !,Dude that’s gay. We only made out,Yep. I’m almost ready.,1,0,1,0,0,0
361582,Clown show market,Lmao its an old handle but it checks out,Anything,0,0,0,0,1,0
36605,"But if we are supposed to inverse WSB, than....",Your wrong. Only reason it spiked so much in the first place is due to retail!,"I miss all of the retarded SPY calls from you guys

$392 3/5 :)",0,0,0,0,0,0
373934,Is she by the sea shore?,"Whatever happens today, don't forget to laugh at the Gibbons who thought they were gorillas, throwing poo at each other in their cage.  The exhibit will be closing very soon",Cope harder,0,0,0,0,0,0
376196,slow is smooth. smooth is fast.,"My yolo dice roll atm is on eeenf/88e. They diggin a hole. Between now and 4/6, something gotta happen, its binary. Good hole or bad hole?",NOK is like watching paint dry,0,0,0,0,0,0
377523,"you sir, are amazing.",Got em coach,I want it to dip again; aint tryna buy at these prices son,0,0,0,0,0,0
379834,"Lol all this gloom and doom sentiment, you newbies will learn patience with time.

This feels bit similar to when tech stocks surged too much in August then dropped in September, only to rise back again a few months later higher than ever","So I guess this is **NOT** the year for me to get started in investing, right? Because I keep getting fucked in the ass",Ok thank you. Ugh it's so stressful lmao.,1,0,0,0,1,0
385509,"Thanks to whoever recommended $CSCW, up 129% in 2 weeks!!",But others dont limit that....so F MS,NIO,0,0,0,0,1,0
385565,"Holy shit, it worked!",The bags may be heavy but they ain't going anywhere.,What are you guys investing in during these deep dip dippy times?,0,0,0,0,0,0
400945,Alexa you fucking idiot,"just bought another micro futures contract. we're probably going to tank from here, sorry","I am balls deep on futures contracts bought with protective puts. Funny thing is, if this market keeps on dropping I may end up making money again. Crazy.",0,0,0,0,0,0
40117,"There is no rational to this once in a life time moment. It had all come down to demand and short squeezes. For example AMD is a great company, ahead of all its competitors and yet it is under performing on the market - 5% down last time I checked. Why?",so pumped for when a handful of rich people decide its time for the market to go up again.,Thought PLTR got its bullshit out of its system down 12 percent but apparently not.,0,0,0,0,0,0
401590,At least only 2.5% of my portfolio is calls... gonna be down 2.5% today,"No doubt about it, I am ready to get cucked again. I am taking calls from anyone who wants to be my wife’s boyfriend.
(800) 813 5555","Commodities are red in a world where the super cycle makes them worth more than gold when the economy reopens.

You know shit is FUK",0,0,0,0,0,0
40319,WTF,I bought the dip,"UVXY puts here, I’ve played that ticker so many times only for it to fuck me over the next day. 

Shit will bounce tmr",0,0,0,0,0,0
404334,I miss the days I could buy any newly added ARKK stock and make 50-100% in a week,"it's going to the core, some bagholders trying to average down rn.",Lmao?,0,0,0,0,0,0
404585,seriously fuck FUBO lol,300 in roblox puts was not the play.,Hey if you bought calls 10 mins ago on almost anything you could’ve sold rn for profit,0,0,0,0,0,0
409883,"dont let anyone tell you this about rates, eps, debt or any pish like that, this is targeted at us and the stocks we buy.",I'll admit I'm perplexed as to how CCL is GREEN despite CDC saying cruises will not resume until November.,Holy SHIT I just made back all my losses on BA calls,0,0,0,0,0,0
412906,"run PLTR up—

like Bill Clintons bitch count if he had cancer and 1 year to live",Man it was pulling earlier now this fake manipulative market won’t crash,how tf are people turning green so fast boy i got a long way to go LOL,0,0,0,0,0,0
416446,Anyone wanna hack Joe’s teleprompter and make him say weed legalization is happening within the next month? Do everyone a solid,Everything but Chinese science (if you can even call it science),Legit can't tell if you're joking,1,0,1,0,0,0
418263,HAHAHAAAAA 🚀🚀🚀🚀🚀🚀🚀,GREEN DILDOS ONLY ALLOWED IN THIS POWER MOTHERFUCKING HOUR,Let’s fucking goooo bois it broke,1,1,0,0,1,0
41827,Tech is long term.,I've made more money with cry pto than with stocks the last few days,The whole market just had a sell off so people could buy more GME,0,0,0,0,0,0
420934,True... Although for the UK Deliveroo are dominant. https://www.thegrocer.co.uk/fundraising/deliveroo-whats-the-investment-case-post-covid/654624.article,We got fukd lol,I can't! I can't! Tried this morning and it's unbearable! Can somebody tell Elmer Fudd to NOT ADLIB!! This guy Joe is unbearable! One of you producers give this guy a script! DON'T ADLIB!! I JUST WANT INFORMATION!! How bad? I have to listen to Maria Bartiromo and I hate her!! Just the facts bro!! NO ADLIB!!,0,0,0,0,1,0
423208,The answer to the question of which direction the market goes lies in 2010 Academy Awards Best Animated Feature Film title,It’s going to be a loooongggg weekend,source or ban,0,0,0,0,0,0
423889,"Apes don’t run shit. Invaded, and ruined yes.","Go to open my TD app it wants my password. Damnit. My phone is blinding me. It’s fucking 5AM on the west coast, so I type in my long ass password... ALERT: TD IS MAKING IMPORTABT CHANGES THAT REQUIRE YOU TO HAVE THE LATEST VERSION OF THE APP PLEASE UPDATE NOW TO CONTINUE. 

FML",almost as if analysts are bullshitting,0,0,0,0,1,0
427674,maybe its time her fucking boyfriend started helping around the house?,Barely any gains yesterday for tech though,Oh man what was I thinking!? I forgot with calls you win when it’s green and with puts you win when you’re dead. My mistake,0,0,0,0,0,0
428539,Today flat as fuck?,It’s up 8%.,"Hell if I know, I personally think it should be worth more",0,0,0,0,0,0
429543,What you thought after 9 red weeks the 10th would be green?,My god. That olde-timemey Direxion turd might actually be pulling a Lazarus. One more reverse split please.,Need those good delivery numbers,0,0,0,0,0,0
43005,This all happened because I sold my SPY puts this morning ffs,180? You paper hands really wanna peak at 180?,"Sold 300 shares, fuck this",1,0,0,1,0,0
434232,Stop the abuse!,*whoooooooooshh*,VIAC HOLY MOLY,0,0,0,0,0,0
435297,"339 advancing stocks and 164 declining, get off robinhood and learn to use a real chart","Rookie numbers, you can go lower. 👍",It’s flowing out in droves,0,0,0,0,0,0
435737,Imagine thinking the market won't recover 🤡,In a year there will be a glitch where -1 becomes 999999,"Impressive, I’ll admit",0,0,0,0,0,0
439834,Definitely unintended consequence but they really didn’t have another choice,"Goldman Sachs is gonna be fine.

They’re going to front run all the shitty positions held by the funds they’re margin calling. 

Point is a lot of shit is gonna get sold across the market for the near future.","definitely a cheating hoe, that one😬",0,0,0,0,1,0
441195,Maybe the bears want some fuk. Most “bears” I know want some fuk.,Shit will still tank but will finish up 50% EOY,"Funny part is, in 5 or 10 years Nomura will have another multi billion dollar credit line with Goldman or another bank",0,0,0,0,1,0
442841,Any thoughts on what the hell TSLA is going to do this week?,Cool.,LEAPs... that way you don’t have to time the bottom exactly right,0,0,0,0,0,0
445417,isnt it crazy how we all die one day,"I came expecting swings and whipsaws.


Wtf is this","Yup, that aint happening",0,0,0,0,1,0
448480,Spy too high,I'm tripled down on my original investment at this point. Idk when I should stop and just let it ride.,"I'm new to puts and paperhanded the fuck out of these after buying them mid-March.

Former owner of  DISCA 16APR21 57.5 P reporting in.",0,0,0,0,0,0
450143,95% of my Portfolio is on EV I'm bleeding profusely...,ESLOF / ESLOY? Not sure what difference is but they're both Luxottica Essilor which is probably what you're asking about,Do you guys ever read Yahoo Finance comments? And the media calls Reddit full of degens.,0,0,0,0,0,0
452353,If you are long then absolutely,Imagine ARKK is the next to be margin called o_O,"Cathie bb, I luv you but it might be time to take a break 💔",0,0,0,0,0,0
460219,Yea I dipped my toes in with $10k yesterday but have a good 15k chunk Im gonna just sit by the sideliness with until we see what happens here.,PLTR absolutely hates the color green,I am such a stupid asshole,0,0,0,0,0,0
463012,RKT keep goin.,This green feels fake.,"You guys are up at any time?

My shit never goes that direction, and when it does: NO BID",0,0,0,0,0,0
463066,spy 397 EOD,"PLTR dead cat bounce, right down to 20 now.",what the fuck happeneddddd i cant find any bad news bro can someone enlighten me,0,0,0,0,0,0
464433,Take,WIMI✅,The RUT making incremental steps upward today. A lot of our stonks mirror it.,0,0,0,0,0,0
465909,I hope it doesn’t I want accumulate the 9% div,hope TSLA has one of those random 20% rips today,TD Ameritrade emails me every day at 5:00am. The first person I communicate with every morning is my broker. That's love.,0,0,0,0,0,0
470310,I wish there was a porn ETF...that shit would 🚀,AMD looking tasty,POWER TO THE MEME ECONOMY,0,0,0,0,0,0
475458,Panic sold ocgn like a little bitch last week ughhh,"It’s bullshit, most make more on unemployment it’s a bitch hiring regular people now.",Not illegal but only could be gluten free with oat milk and a side of daddys $$,0,0,0,0,1,0
484738,UTF,Mahn is pltr 1dte 25c at risk?,Spy 1dte poots fuck it,0,0,0,0,0,0
485103,Like it’s knocking out of the ball park? Or it’s receiving the fade?,Im surprised no one on WSB picked up on the $UI Ubiquity whistleblowing and posted about it. Granted their options are illiquid as fck.... maybe not the best for the WSB hug. I bought 2 long dated $250p this AM,Lol dead cat bounce. Not a chance at rebounding,0,0,0,0,1,0
485673,"I've got a $665C, a $670C, a $700C, and a $705C. Puts or calls on my brain wrinkles?","WSB doesn’t shape the stock market.

But BB does trend a bit with GME. So it could see a smaller spike if GME squeezes.",Basically like a tuition fee but for the stock market,0,0,0,0,0,0
490201,I didn’t hear no bell.,"""Kruger Industrial Smoothing isss heading intoooo the red.... or the black.... ... whatever the bad one is... any thoughts?"" ""Well, i sometimes drop off my rent cheque after ""forgotten"" to sign it.. that could buy us some time.."" ""WORKS FOR ME!! Good thinking George!""",Stop reading my mind,0,0,0,0,0,0
490803,Tf kind of math r u using🤡,lel.,"*Me looking at the morning trade futures*

🤑

*Me watching the Wall Street bigs giggling in a corner and then realizing what day it is*

😰",0,0,0,0,0,0
492494,Breaking - Steel closing all retail locations,LOL someone put a market order on some 315 QQQ puts and got them for .45 at open. I’m sure they’re fucking piiiisssseed,"#”WE PRINT IT, DIGITALLY” -JPOW

#”INFINITE TOOLS”",0,0,0,0,1,0
493074,Pls,F,Ok everyone needs to say sorry daddy Biden,0,0,0,0,0,0
49468,Doubtful.,"GMBL, SAVA, APHA -  all on the move today.","Negative Batman, has to be in the same trading day",0,0,0,0,0,0
497923,Buy the speculation,"So when SPY inevitably hits 400 (idk if it will happen today, but it’s gonna happen), that will be interesting to see. I feel like so many wsbtards have puts and calls on it that it may just stay at 400 for a full day and only fluctuate by one cent (see: AMC a few weeks ago)",koolaid,0,0,0,0,1,0
49864,"i’m holding RKT and GME calls and I’m gonna be on a plane during market open fml
edit: flying frontier no wifi :(",10:15 est?,Vaccines have not done shit for stocks.,0,0,0,0,0,0
50062,"If RKT hits 100 AND GME hits 400 today, I will legally change my name to Jim Cramer Jnr",Maybe smoke some weed,Oooooooh tendie potential loading,0,0,0,0,0,0
501339,you don’t remember november?,Dew it,"OR - you get some people who see that low liquidity can create a spike and a bunch of WSB Autists decide to start buying it and then people FOMO in. You’re not gonna get 35k shares trading hands off of 1,180 shares short or 9% of daily volume.",0,0,0,0,0,0
502721,Time will tell :D,"#Ok we punched it up to SPY 400, now we can start the real Dump!!!!!",FUBO & APHA,0,0,0,0,0,0
503326,Why r u gae,"IDK, get a second opinion from her boyfreind",Motley Fools,0,0,0,1,0,0
504524,"1) indicator of whole stock market 

2) in terms of options provides a lot of opportunities for multi baggers . Very close strike dates plus low IVs. When things align sky is the limit for profits and losses",Why would the market be closed on Monday dumbass,Not gonna dispute that. You may have many tendies,1,0,0,1,1,0
51115,Literally pinned to the top of this fucking thread,I’m only upvoting insults and funny shit today.,UWMC,0,0,0,0,1,0
516793,CHAD,"QQQ AND SPY$ have been monsters 

IMAGINE INVESTING IN SPACS LIKE A FUCKEN IDIOT NOOB 

YEA A NOOB 

When for years qqq and spy have been rigged to go up !!! 🤣🤣🤣🤣🤣","Only because I sold the position I've been carrying since August.

Piece of shit, runs from $290 like it's cancer every time and the time I decide to let it go and reload is when it runs.",0,0,1,0,1,0
518591,#F,absolutely not,Puts on this guy’s shoulder!,0,0,0,0,0,0
519438,And nnox,When UWMC is only thing green in your portfolio you certainly doing something wrong 🤣,"4/16, down about 10% rn due to IV crush, but as long as it gets ITM this week even theta decay won't maul me too badly",0,0,0,0,0,0
52600,Reminder that you can block the obvious shill accounts,I woke up Friday wanting to own 50 RKT shares before this pump anyway because it's a really solid company the pump is just icing on the cake RKT to the moon,You must love losing money,0,0,0,0,0,0
52991,Which is why you buy good management,Lol I didn't wrap it but I got tested a few months later and I'm clean clean clean thank god I was nervous,What is up with OCGN?? Up 28% pm. K M P H jumping too. Up 70%,0,0,0,0,0,0
530254,I can’t wait to sell mine,"It hit 9.01 like two weeks ago and i sold because it was right before the dividend date, never looked back","Yup, bought into the uwmc hype haha lost a hundred on that play. Then again rocket and gme made me so much money",0,0,0,0,0,0
534160,"When banks start acting more retarded than me, I get skeptical. Maybe its the bear in me, maybe its Maybelline","Ok Elon, tweet something stupid. Today is the day you take me to the moon",So when do sell RMO?? Opinions only,0,0,0,0,0,0
534539,"Romeo romeo, wherefore art thou romeo",You’re not wrong good I am the fool for watching them,"On my penny stock shit. Up 25% premarket

In other news, SPY 400 incoming",0,0,0,0,0,0
53665,The retard strength is high today,Rip rkt,Robinhood telling me how great UWMC is doing despite not executing my order at $10 an hour ago when I placed it is real nice.,0,0,0,0,0,0
538480,"Crush a bit, lil bit, roll it up, take a hit?",DOW down down down,Tech will cut your dick off. Eeekk,0,0,0,0,0,0
538601,Def not for a long time though.,I thought weed stonks were supposed to go Brrrrrr.,Doesn't growth imply a product ppl are buying/need? U sound like a fucking idiot. Just post your boomer tickers and stfu,0,0,0,0,0,0
540480,PLTR,"Apha 15.8by eod. 

You killing me, smalls...","Man. Why’d I FOMO into CNK instead of waiting for a dip? I know better than this shit.

It’s still got a solid summer ahead of it, but I def could have found a better entry position.",0,0,0,0,0,0
542039,You guys think spy hits 408 next week for flat forever,FUBO is like a fat chick you smashed. You know you shouldn’t jump in but you do anyways. Then once reality slaps you in the face you dip out and pretend it never happened.,Started the wheel for PLTR today.  I prolly belong at thetagang now,0,0,0,0,1,0
542301,you haven't seen me play,🌈,My avg is $32 bc when I buy everything drops a dollar and just chills,0,0,0,0,0,0
544531,"Any thoughts on $OUST?

Crazy volume today",I got a rule violation warning for promoting hate because I called SPY fake and gay.,26 by April 16,0,0,1,0,0,0
545173,"Holy fuck am I glad I sold my calls 30 min after open.  


Sorry to you bagholders out there. The good news is that I'm going to have an opportunity to get fucked all over again tomorrow by buying Visa 4/16 220 calls at close again.",Wife thought it was a bit arbitrary to put the kid in timeout until a Nio green-day. IDK,Bears celebrating for .02% down.  So fucking 🌈,0,0,0,0,0,0
549167,"At this point is there anything that’s not priced in?

Seriously feel like the last real gamble was Georgia runoffs",I audibly laughed out what the fuck when I read this.,It’s 9am,0,0,0,0,1,0
555640,Banks dont eat losses like that. We the tax payers bail them out,"Like a true bear i am looking at my 0.07% gains and thinking ""fuck yeah it isn't red""","I'm afraid that's one of the positions I closed. I made a decent margin on it but I worry PLTR is going to drop in the short term. They're facing scrutiny for the awarding of government contracts in the UK and I think there's a strong possibility the same could happen to US contracts. Long term it's a good stock to invest in, but I think I could drop further in the short term.",0,0,0,0,1,0
555772,\-Or when you go homeless,If you’re gonna throw money away just give it to me,been waiting for a healthy dip on SPY to buy in again. my balls are aching,0,0,0,0,0,0
557696,"this is the casino, get out of here with that reasonable shit",Daily,"took 6 weeks at the beginning of 2021 to make the same amount of amount of gains we have made in 1 week.

again, very legit and cool. surely only more green to come. certainly right? right?

😂",0,0,0,0,0,0
559568,Blockbuster is still pretty recognizable.,Are GameStop people just going to talk about only this stock every day for the rest of their life?,whatever you do it better not be shares or ur a pussy,0,0,0,0,0,0
562965,Wont the market just rise with inflation anyways,"I think that’s the play. Between how low it is now, earnings, merger and 420 there’s bound to be some moment in the next 3 weeks where it shoots up","As long as nothing crazy random happens.  There is that lawsuit.  But if nothing comes from that, then I can see it getting back to $40 within a year.",0,0,0,0,0,0
565698,spy only go up,Apple eod predictions?,SRNE,0,0,0,0,0,0
567425,wall st ain’t main st,DFV calls expire in a week and he potentially cashes out his shares. That crash will be one of the most glorious things in the history of this sub.,Tesla let’s go bb,0,0,0,0,0,0
567561,Lolapes,Dude on CNBC is lying through his fucking teeth lol,Sunken cost isn't a fallacy it's a life style,0,0,0,0,1,0
5679,"Nobody cares about anything you mentioned besides GME

Rest are diversions",GME TO THE MIZOON,"1) $NOK
2) $AMC
3) $GME",0,0,0,0,0,0
571827,I got an amber alert saying fuck my puts,spy only go up,RIP Prince Philip. Guy was a badass.,0,0,0,0,0,0
573112,Thank you for your sacrifice,"Anyone who posts comments that are only a ticker and rockets or says it's ""mooning"" when it's up less than 1% should get banned.",THE MARKET SAID FUCK YOUR PUTS 😳,0,0,0,0,0,0
573551,"About to claim 1billion inheritance from Nigerian prince, just need to pay $500 dollars first. Don't need to invest in these risky stocks from now","PLTR probably going to melt up slowly until event on Wednesday

It’ll be either a sell the hype or hype continues for a few days

Probably safest for anyone wanting to get in now on either longer dated calls or shares 

Either way this shit is going up soon 🚀",BLIND FURYYYYYYYY,0,0,0,0,1,0
573937,Call me James Charles Im not stopping til I make me a milly,I'm LOL so hard at these angry ass homeless boomers disliking my comment. Pathetic apes.,fuck just my luck FUBO is red,1,0,1,1,1,0
576012,Still Bullish on apha/Tlry for merger,Amd has down syndrome,"Puts until the financial crisis.

INDA puts.

Immune escape covid coming.",0,0,0,0,0,0
576715,Lol,VIAC is set for take off 🚀,Pretty much cash right now. Waiting an hour in to sell some CSPs.,0,0,0,0,0,0
577599,Apha had bad earnings.,"Yeah I sold half of them the 4/16 this morning. I honestly thought the gap would be bigger this morning but I'm still pretty confident they're still going down short term to at least 79. Maybe even by EOD. Either that or 80ish EOD, open down tomorrow then back up. But could just be wishful thinking",Pfff I wish,0,0,0,0,0,0
